"","Sector","URN","Places","Local.authority","Organisation","Registration.date","Overall.experiences.and.progress.of.children.and.young.people","Latest.full.inspection.date","Homes","Join","Leave","keep"
"1","Local Authority","SC037454",5,"WEST SUSSEX","West Sussex County Council","21/02/2003","Outstanding",2015-03-27,1,"2014-01-01",NA,NA
"2","For-profit","SC472139",2,"WEST BERKSHIRE","Amegreen Children's Services Limited","13/11/2013","Good",2015-03-26,1,"2014-01-01",NA,NA
"3","For-profit","SC472164",4,"WEST BERKSHIRE","Amegreen Children's Services Limited","13/11/2013","Good",2015-03-25,1,"2014-01-01",NA,NA
"4","For-profit","SC480502",4,"HAMPSHIRE","New Forest Care Ltd","22/09/2014","Good",2015-03-25,1,"2014-09-22",NA,NA
"5","Third Sector","SC433451",6,"SUNDERLAND","St Cuthbert's Care","05/09/2011","Outstanding",2015-03-19,1,"2014-01-01",NA,NA
"6","Local Authority","SC462583",4,"NORFOLK","Norfolk County Council Children's Services","29/04/2013","Good",2015-03-19,1,"2014-01-01",NA,NA
"7","Local Authority","SC059639",8,"BRADFORD",NA,NA,"Inadequate",2015-03-18,1,"2014-01-01","2015-04-01",NA
"8","For-profit","SC461240",4,"ESSEX","Care Focus Limited","09/05/2013","Good",2015-03-17,1,"2014-01-01","2022-08-24",NA
"9","For-profit","SC479070",45,"OXFORDSHIRE",NA,NA,"Outstanding",2015-03-17,1,"2014-08-21","2017-07-31",NA
"10","For-profit","SC457428",2,"SEFTON",NA,NA,"Good",2015-03-17,1,"2014-01-01","2017-03-10",NA
"11","For-profit","SC463558",6,"HAMPSHIRE","The Serendipity Centre Limited","28/05/2013","Outstanding",2015-03-11,1,"2014-01-01","2019-09-20",NA
"12","For-profit","SC466315",4,"HAMPSHIRE",NA,NA,"Good",2015-03-11,1,"2014-01-01","2016-05-05",NA
"13","For-profit","SC443959",8,"LANCASHIRE","Priory New Education Services Limited 07221650","03/05/2012","Inadequate",2015-03-11,1,"2014-01-01",NA,NA
"14","For-profit","SC062782",4,"BLACKPOOL",NA,NA,"Good",2015-03-11,1,"2014-01-01","2016-09-18",NA
"15","For-profit","SC482298",14,"STAFFORDSHIRE",NA,NA,"Outstanding",2015-03-10,1,"2014-10-12","2017-07-11",NA
"16","For-profit","SC457502",1,"WIRRAL",NA,NA,"Good",2015-03-10,1,"2014-01-01","2015-11-25",NA
"17","For-profit","SC479281",2,"NORTHUMBERLAND","Howard House Care Limited","03/09/2014","Good",2015-03-09,1,"2014-09-03","2020-10-29",NA
"18","For-profit","SC476748",4,"WEST SUSSEX",NA,NA,"Good",2015-03-06,1,"2014-05-02","2017-09-14",NA
"19","Local Authority","SC035500",24,"SOUTH GLOUCESTERSHIRE","South Gloucestershire Council","15/01/2003","Good",2015-03-02,1,"2014-01-01",NA,NA
"20","Third Sector","SC394025",60,"SURREY","The National Centre for Young People with Epilepsy","09/06/2009","Outstanding",2015-02-27,1,"2014-01-01","2020-09-01",NA
"21","For-profit","SC425859",3,"STAFFORDSHIRE","Roundhouse Care Ltd","28/04/2011","Outstanding",2015-02-27,1,"2014-01-01",NA,NA
"22","For-profit","SC023741",3,"KENT","Ethelbert Specialist Homes Limited","26/06/2001","Good",2015-02-26,1,"2014-01-01",NA,NA
"23","For-profit","SC478315",4,"HAMPSHIRE","The Serendipity Centre Limited","09/06/2014","Outstanding",2015-02-26,1,"2014-06-09",NA,NA
"24","Third Sector","SC445174",4,"CHESHIRE EAST",NA,NA,"Good",2015-02-26,1,"2014-01-01","2017-06-30",NA
"25","For-profit","SC443708",3,"SHROPSHIRE","Physis Quantum Limited","13/08/2012","Good",2015-02-26,1,"2014-01-01",NA,NA
"26","For-profit","SC476259",4,"SHROPSHIRE",NA,NA,"Good",2015-02-26,1,"2014-06-20","2017-12-08",NA
"27","Local Authority","SC038690",5,"HAMPSHIRE","Hampshire County Council",NA,"Good",2015-02-25,1,"2014-01-01","2018-06-01",NA
"28","Local Authority","SC030369",2,"SOMERSET",NA,NA,"Inadequate",2015-02-25,1,"2014-01-01","2016-02-05",NA
"29","Local Authority","SC479244",3,"WORCESTERSHIRE","Worcestershire County Council",NA,"Good",2015-02-25,1,"2014-07-23","2018-11-08",NA
"30","For-profit","SC480318",4,"SHROPSHIRE","Bryn Melyn Care","26/08/2014","Good",2015-02-25,1,"2014-08-26",NA,NA
"31","For-profit","SC023737",3,"KENT","Ethelbert Specialist Homes Limited","26/06/2001","Outstanding",2015-02-24,1,"2014-01-01",NA,NA
"32","For-profit","SC464249",2,"BIRMINGHAM","Thoughts of Others Ltd",NA,"Good",2015-02-24,1,"2014-01-01","2018-07-26",NA
"33","For-profit","SC480429",1,"LANCASHIRE","Cambian Childcare Ltd","08/08/2014","Good",2015-02-24,1,"2014-08-08",NA,NA
"34","For-profit","SC452461",8,"NORFOLK","SES Turnstone Limited","28/09/2012","Good",2015-02-24,1,"2014-01-01",NA,NA
"35","For-profit","SC474863",5,"OXFORDSHIRE",NA,NA,"Outstanding",2015-02-24,1,"2014-05-14","2017-05-26",NA
"36","Local Authority","SC044485",7,"NEWCASTLE UPON TYNE","Newcastle City Council","29/01/2004","Good",2015-02-23,1,"2014-01-01","2019-08-16",NA
"37","For-profit","SC454688",3,"CUMBRIA","Key Change Children's Service Limited",NA,"Good",2015-02-23,1,"2014-01-01","2018-03-31",NA
"38","For-profit","SC064117",7,"COVENTRY","Progress Children's Services","25/08/2005","Inadequate",2015-02-20,1,"2014-01-01",NA,NA
"39","For-profit","SC069474",3,"EAST SUSSEX","Anderida Adolescent Care","12/03/2007","Good",2015-02-19,1,"2014-01-01",NA,NA
"40","For-profit","SC468019",4,"TELFORD AND WREKIN",NA,NA,"Good",2015-02-18,1,"2014-01-01","2017-02-06",NA
"41","For-profit","SC480847",6,"EAST RIDING OF YORKSHIRE","Hexagon Care Services Limited","01/12/2014","Good",2015-02-18,1,"2014-12-01",NA,NA
"42","For-profit","SC055912",4,"COVENTRY","Verve Life Limited","16/04/2004","Inadequate",2015-02-18,1,"2014-01-01","2020-09-30",NA
"43","For-profit","SC005067",6,"STAFFORDSHIRE","Esland North Limited","05/01/1998","Good",2015-02-18,1,"2014-01-01","2021-10-08",NA
"44","For-profit","SC472795",5,"NEWCASTLE UPON TYNE","Artemis Support Ltd","02/01/2014","Good",2015-02-17,1,"2014-01-01",NA,NA
"45","For-profit","SC478991",4,"STAFFORDSHIRE","Esland North Limited","02/06/2014","Good",2015-02-17,1,"2014-06-02",NA,NA
"46","For-profit","SC011972",6,"HAMPSHIRE","Hillcrest Children's Services Ltd","15/12/1992","Good",2015-02-16,1,"2014-01-01",NA,NA
"47","Third Sector","SC033467",8,"NEWCASTLE UPON TYNE","St Cuthbert's Care","25/06/2003","Good",2015-02-16,1,"2014-01-01",NA,NA
"48","Local Authority","SC476220",4,"SEFTON","Sefton Metropolitan Borough Council","10/04/2014","Good",2015-02-13,1,"2014-04-10","2020-09-02",NA
"49","Third Sector","SC469627",4,"CHESHIRE EAST",NA,NA,"Good",2015-02-12,1,"2014-01-01","2017-03-31",NA
"50","Local Authority","SC033808",7,"WAKEFIELD","Wakefield Metropolitan District Council","08/09/2003","Outstanding",2015-02-12,1,"2014-01-01",NA,NA
"51","For-profit","SC480784",4,"LEICESTERSHIRE",NA,NA,"Good",2015-02-12,1,"2014-09-08","2015-11-11",NA
"52","For-profit","SC448997",2,"KENT","Moonreach Ltd","06/06/2012","Good",2015-02-12,1,"2014-01-01",NA,NA
"53","For-profit","SC430002",6,"NORTH YORKSHIRE","Roseberry Specialist Care Centres Ltd","21/06/2011","Inadequate",2015-02-11,1,"2014-01-01","2021-06-07",NA
"54","Third Sector","SC004429",5,"WARWICKSHIRE","Action For Children","31/01/1994","Outstanding",2015-02-11,1,"2014-01-01",NA,NA
"55","Local Authority","SC034220",7,"NORTH YORKSHIRE","North Yorkshire County Council","14/10/2003","Good",2015-02-11,1,"2014-01-01",NA,NA
"56","For-profit","SC459934",6,"DERBYSHIRE","Quantum Care UK Limited","11/04/2013","Outstanding",2015-02-11,1,"2014-01-01","2019-04-26",NA
"57","For-profit","SC429762",10,"HARTLEPOOL","Atlas Healthcare Ltd","13/05/2013","Good",2015-02-10,1,"2014-01-01","2021-03-05",NA
"58","For-profit","SC480705",3,"HAMPSHIRE","Arc Hd Services Ltd","01/09/2014","Good",2015-02-10,1,"2014-09-01",NA,NA
"59","For-profit","SC450728",2,"CALDERDALE","Time-Out Children's Homes Limited","13/08/2012","Good",2015-02-10,1,"2014-01-01",NA,NA
"60","For-profit","SC431603",3,"LIVERPOOL",NA,NA,"Good",2015-02-09,1,"2014-01-01","2016-11-30",NA
"61","For-profit","SC036528",16,"DEVON",NA,NA,"Inadequate",2015-02-09,1,"2014-01-01","2017-09-29",NA
"62","For-profit","SC480422",6,"CUMBRIA","Witherslack Group Ltd","28/07/2014","Good",2015-02-06,1,"2014-07-28",NA,NA
"63","Third Sector","SC441865",3,"NOTTINGHAMSHIRE","Shyne Together Limited","29/07/2012","Good",2015-02-06,1,"2014-01-01",NA,NA
"64","Local Authority","SC059853",6,"BOLTON","Bolton Metropolitan Borough Council","26/05/2004","Outstanding",2015-02-05,1,"2014-01-01",NA,NA
"65","For-profit","SC428196",4,"LANCASHIRE",NA,NA,"Inadequate",2015-02-05,1,"2014-01-01","2015-04-17",NA
"66","For-profit","SC025938",6,"REDBRIDGE","Five Rivers Child Care Limited","09/08/1996","Good",2015-02-05,1,"2014-01-01","2021-09-24",NA
"67","Local Authority","SC034162",7,"WAKEFIELD","Wakefield Metropolitan District Council","24/07/2003","Outstanding",2015-02-05,1,"2014-01-01",NA,NA
"68","Third Sector","SC008596",8,"STOCKPORT",NA,NA,"Good",2015-02-05,1,"2014-01-01","2016-07-13",NA
"69","For-profit","SC443765",3,"CUMBRIA","ABC Care and Education Ltd","09/05/2012","Good",2015-02-05,1,"2014-01-01",NA,NA
"70","For-profit","SC457776",3,"LEICESTERSHIRE",NA,NA,"Inadequate",2015-02-05,1,"2014-01-01","2016-07-11",NA
"71","For-profit","SC432966",4,"BIRMINGHAM","Nh Care Limited","27/07/2011","Good",2015-02-04,1,"2014-01-01",NA,NA
"72","For-profit","SC357981",4,"KENT","Benecare Limited","03/09/2007","Inadequate",2015-02-04,1,"2014-01-01",NA,NA
"73","For-profit","SC422346",4,"NORFOLK",NA,NA,"Good",2015-02-04,1,"2014-01-01","2016-02-15",NA
"74","For-profit","SC461716",1,"LIVERPOOL",NA,NA,"Good",2015-02-03,1,"2014-01-01","2015-07-11",NA
"75","For-profit","SC462631",3,"CROYDON","","11/09/2013","Good",2015-02-03,1,"2014-01-01",NA,NA
"76","For-profit","SC028599",4,"LUTON","Children and Family Services Limited","01/05/2002","Good",2015-02-03,1,"2014-01-01",NA,NA
"77","For-profit","SC481152",6,"CHESHIRE EAST","Hexagon Care Services Limited","08/09/2014","Good",2015-02-03,1,"2014-09-08",NA,NA
"78","For-profit","SC476289",5,"DERBYSHIRE","Cambian Childcare Ltd","15/01/2015","Good",2015-02-03,1,"2015-01-15",NA,NA
"79","For-profit","SC063080",5,"CROYDON",NA,NA,"Good",2015-02-02,1,"2014-01-01","2017-01-04",NA
"80","For-profit","SC434837",3,"READING",NA,NA,"Inadequate",2015-02-02,1,"2014-01-01","2016-08-09",NA
"81","Local Authority","SC059203",6,"NORTHUMBERLAND","Northumberland County Council","15/06/2004","Outstanding",2015-01-31,1,"2014-01-01",NA,NA
"82","For-profit","SC481295",5,"CHESHIRE WEST AND CHESTER","Imap Centre Limited","23/09/2014","Good",2015-01-30,1,"2014-09-23",NA,NA
"83","Local Authority","SC034797",6,"NORFOLK","Norfolk County Council Children's Services","24/12/2003","Good",2015-01-30,1,"2014-01-01",NA,NA
"84","For-profit","SC061795",6,"WEST SUSSEX","Southern Adolescent Care Services Ltd","08/09/2004","Good",2015-01-29,1,"2014-01-01",NA,NA
"85","For-profit","SC391594",3,"SHEFFIELD","Pathway Care Solutions Ii Ltd","05/06/2009","Good",2015-01-29,1,"2014-01-01",NA,NA
"86","Local Authority","SC040132",4,"CORNWALL","Cornwall Council","15/07/2003","Inadequate",2015-01-29,1,"2014-01-01",NA,NA
"87","For-profit","SC482293",6,"HAMPSHIRE","Hillcrest Childrens Services Limited","22/09/2014","Good",2015-01-29,1,"2014-09-22",NA,NA
"88","Local Authority","SC359836",6,"LANCASHIRE","Lancashire County Council","05/09/2007","Good",2015-01-29,1,"2014-01-01",NA,NA
"89","Local Authority","SC040982",5,"WIGAN","Wigan Council","30/05/2003","Outstanding",2015-01-29,1,"2014-01-01",NA,NA
"90","For-profit","SC408584",3,"KENT","Channels and Choices Limited","03/06/2010","Good",2015-01-29,1,"2014-01-01",NA,NA
"91","For-profit","SC434806",3,"LEICESTERSHIRE","Cambian Childcare Ltd","15/09/2011","Good",2015-01-29,1,"2014-01-01",NA,NA
"92","For-profit","SC475706",7,"DURHAM","Witherslack Group Ltd","28/05/2014","Good",2015-01-29,1,"2014-05-28",NA,NA
"93","Third Sector","SC459857",8,"EALING","St Christopher's Fellowship","26/04/2013","Good",2015-01-29,1,"2014-01-01",NA,NA
"94","Third Sector","SC024376",9,"SUFFOLK",NA,NA,"Good",2015-01-28,1,"2014-01-01","2017-06-05",NA
"95","Third Sector","SC025395",25,"SEFTON","Nugent Care","19/02/2002","Outstanding",2015-01-28,1,"2014-01-01",NA,NA
"96","Third Sector","SC038163",10,"BEXLEY",NA,NA,"Good",2015-01-28,1,"2014-01-01","2017-06-12",NA
"97","For-profit","SC061158",1,"CUMBRIA","Radical Services Ltd","20/05/2004","Outstanding",2015-01-28,1,"2014-01-01",NA,NA
"98","Third Sector","SC062079",33,"SURREY","The Children's Trust","29/12/2005","Good",2015-01-28,1,"2014-01-01",NA,NA
"99","For-profit","SC465579",3,"KENT","Benecare Limited","16/08/2013","Good",2015-01-28,1,"2014-01-01",NA,NA
"100","For-profit","SC466515",3,"WOLVERHAMPTON",NA,NA,"Inadequate",2015-01-28,1,"2014-01-01","2015-08-07",NA
"101","For-profit","SC005041",10,"STAFFORDSHIRE","Daisybrook Limited","17/02/1997","Good",2015-01-28,1,"2014-01-01",NA,NA
"102","For-profit","SC480161",6,"TAMESIDE","Hexagon Care Services Limited","10/09/2014","Outstanding",2015-01-28,1,"2014-09-10",NA,NA
"103","Third Sector","SC022448",12,"ST HELENS","Nugent Care","18/02/2002","Good",2015-01-28,1,"2014-01-01",NA,NA
"104","For-profit","SC035049",3,"CUMBRIA","Partners in Care Limited","13/08/2002","Outstanding",2015-01-28,1,"2014-01-01",NA,NA
"105","Local Authority","SC051856",4,"WIGAN","Wigan Council","22/01/2004","Good",2015-01-28,1,"2014-01-01",NA,NA
"106","For-profit","SC435322",40,"NORFOLK","Acorn Norfolk Limited","15/09/2011","Good",2015-01-28,1,"2014-01-01","2022-11-22",NA
"107","For-profit","SC010700",3,"ENFIELD","Sherico Care Services Limited","20/12/2001","Good",2015-01-27,1,"2014-01-01","2020-09-30",NA
"108","For-profit","SC413085",3,"KENT","Castle Homes Limited","23/06/2010","Good",2015-01-27,1,"2014-01-01",NA,NA
"109","For-profit","SC482301",6,"HAMPSHIRE","Hillcrest Childrens Services Limited","22/09/2014","Good",2015-01-27,1,"2014-09-22",NA,NA
"110","Local Authority","SC403850",6,"KENT","Kent County Council","02/02/2010","Good",2015-01-27,1,"2014-01-01",NA,NA
"111","For-profit","SC363395",4,"SOMERSET",NA,NA,"Good",2015-01-27,1,"2014-01-01","2017-12-31",NA
"112","For-profit","SC456724",4,"WEST SUSSEX",NA,NA,"Outstanding",2015-01-27,1,"2014-01-01","2017-03-01",NA
"113","For-profit","SC062939",3,"KIRKLEES","Rosedale Children's Services Limited","06/01/2005","Outstanding",2015-01-27,1,"2014-01-01","2019-10-07",NA
"114","Third Sector","SC438756",5,"CAMBRIDGESHIRE","Action For Children","24/10/2011","Good",2015-01-27,1,"2014-01-01","2020-09-03",NA
"115","Local Authority","SC441973",5,"CUMBRIA",NA,NA,"Good",2015-01-27,1,"2014-01-01","2017-01-17",NA
"116","Local Authority","SC442886",4,"STOCKTON ON TEES","Stockton on Tees Borough Council","15/03/2012","Outstanding",2015-01-27,1,"2014-01-01",NA,NA
"117","For-profit","SC465475",6,"NEWCASTLE UPON TYNE","Right-Trak Limited","26/07/2013","Good",2015-01-26,1,"2014-01-01",NA,NA
"118","Local Authority","SC472449",6,"NORTH LINCOLNSHIRE","North Lincolnshire Council","10/12/2013","Good",2015-01-26,1,"2014-01-01",NA,NA
"119","Local Authority","SC036023",8,"SHEFFIELD","Sheffield City Council","27/03/2003","Outstanding",2015-01-26,1,"2014-01-01",NA,NA
"120","For-profit","SC382595",5,"NEWCASTLE UPON TYNE","Evolution Childrens Services Limited","23/10/2008","Good",2015-01-26,1,"2014-01-01",NA,NA
"121","For-profit","SC421531",3,"CENTRAL BEDFORDSHIRE","Oracle Care Limited","15/11/2010","Good",2015-01-26,1,"2014-01-01",NA,NA
"122","Third Sector","SC425786",9,"KENT","Strode Park Foundation for People with Disabilities","30/03/2011","Good",2015-01-26,1,"2014-01-01",NA,NA
"123","Third Sector","SC060034",6,"NORFOLK","Break","13/08/2004","Good",2015-01-23,1,"2014-01-01",NA,NA
"124","Local Authority","SC428084",7,"WAKEFIELD","Wakefield Metropolitan District Council","27/04/2011","Outstanding",2015-01-23,1,"2014-01-01",NA,NA
"125","For-profit","SC429702",4,"SUFFOLK","The Ryes College Limited","27/04/2011","Good",2015-01-23,1,"2014-01-01",NA,NA
"126","For-profit","SC462593",4,"CALDERDALE","G B A Care Ltd","17/04/2013","Outstanding",2015-01-23,1,"2014-01-01",NA,NA
"127","Local Authority","SC035678",9,"EALING",NA,NA,"Inadequate",2015-01-23,1,"2014-01-01","2016-07-24",NA
"128","For-profit","SC063103",5,"LANCASHIRE","Lifetime Opportunities Ltd","21/03/2005","Outstanding",2015-01-23,1,"2014-01-01",NA,NA
"129","For-profit","SC068645",5,"WILTSHIRE",NA,NA,"Good",2015-01-22,1,"2014-01-01","2016-03-31",NA
"130","For-profit","SC393940",5,"ESSEX","Potton Homes Ltd","29/05/2009","Outstanding",2015-01-22,1,"2014-01-01",NA,NA
"131","Local Authority","SC033662",16,"BIRMINGHAM",NA,NA,"Good",2015-01-22,1,"2014-01-01","2018-03-21",NA
"132","Local Authority","SC033840",9,"MIDDLESBROUGH","Middlesbrough Borough Council","29/04/2003","Good",2015-01-22,1,"2014-01-01",NA,NA
"133","For-profit","SC063380",4,"TELFORD AND WREKIN","Family Care Associates Limited","16/03/2005","Good",2015-01-22,1,"2014-01-01",NA,NA
"134","Local Authority","SC063550",6,"ST HELENS","St Helens Metropolitan Borough Council","22/03/2005","Good",2015-01-22,1,"2014-01-01",NA,NA
"135","For-profit","SC032083",2,"CHESHIRE WEST AND CHESTER","Castle Homes Care Ltd","27/06/2002","Good",2015-01-22,1,"2014-01-01",NA,NA
"136","For-profit","SC366107",3,"SHROPSHIRE","Reflexion Care Group Limited","07/01/2008","Good",2015-01-22,1,"2014-01-01","2022-03-31",NA
"137","For-profit","SC423453",4,"ESSEX","Kedleston (Wood Grove Childcare) Ltd","25/03/2011","Outstanding",2015-01-22,1,"2014-01-01",NA,NA
"138","For-profit","SC407790",5,"SOUTHAMPTON","Priory Education Services Limited 06244880","24/03/2010","Good",2015-01-22,1,"2014-01-01",NA,NA
"139","Local Authority","SC458025",2,"STOKE ON TRENT",NA,NA,"Good",2015-01-22,1,"2014-01-01","2017-06-16",NA
"140","For-profit","SC460973",3,"SHROPSHIRE","Reflexion Care Group Limited","24/04/2013","Good",2015-01-21,1,"2014-01-01",NA,NA
"141","Third Sector","SC019441",5,"HERTFORDSHIRE","Jubilee House Care Trust Limited","29/12/1998","Good",2015-01-21,1,"2014-01-01",NA,NA
"142","Local Authority","SC034108",6,"TAMESIDE","Tameside Mbc","10/09/2003","Outstanding",2015-01-21,1,"2014-01-01",NA,NA
"143","For-profit","SC478001",4,"STAFFORDSHIRE","Longdon Hall School Limited","11/07/2014","Good",2015-01-21,1,"2014-07-11","2023-03-25",NA
"144","For-profit","SC479632",5,"CUMBRIA","Hopscotch Care Limited","06/08/2014","Good",2015-01-21,1,"2014-08-06",NA,NA
"145","For-profit","SC059437",3,"SOMERSET","Crossways Care Ltd",NA,"Inadequate",2015-01-21,1,"2014-01-01","2018-05-15",NA
"146","For-profit","SC456225",4,"BIRMINGHAM",NA,NA,"Inadequate",2015-01-21,1,"2014-01-01","2015-04-29",NA
"147","For-profit","SC363384",4,"NOTTINGHAMSHIRE","Broadwood Education Services","07/09/2007","Good",2015-01-21,1,"2014-01-01",NA,NA
"148","For-profit","SC398947",6,"DURHAM",NA,NA,"Good",2015-01-21,1,"2014-01-01","2016-07-31",NA
"149","For-profit","SC424897",5,"NORFOLK","Clover Childcare Services Ltd","26/04/2011","Outstanding",2015-01-21,1,"2014-01-01",NA,NA
"150","Local Authority","SC040583",3,"STOCKTON ON TEES","Stockton on Tees Borough Council","29/01/2003","Outstanding",2015-01-21,1,"2014-01-01",NA,NA
"151","For-profit","SC052946",5,"REDBRIDGE","Care 2 Share 2 Ltd","08/12/2003","Outstanding",2015-01-21,1,"2014-01-01",NA,NA
"152","For-profit","SC053529",5,"PETERBOROUGH","The Beeches UK Ltd","18/12/2003","Good",2015-01-21,1,"2014-01-01",NA,NA
"153","For-profit","SC386810",1,"ST HELENS","Crossway Services Limited","13/01/2009","Good",2015-01-21,1,"2014-01-01",NA,NA
"154","For-profit","SC411054",2,"STAFFORDSHIRE","Horizon Care Limited","28/05/2010","Outstanding",2015-01-21,1,"2014-01-01","2020-05-05",NA
"155","For-profit","SC434517",4,"KENT","Channels and Choices Limited","23/12/2011","Good",2015-01-21,1,"2014-01-01",NA,NA
"156","Local Authority","SC033152",6,"NORTH LINCOLNSHIRE","North Lincolnshire Council","18/05/2004","Good",2015-01-20,1,"2014-01-01",NA,NA
"157","For-profit","SC429778",15,"STOCKTON ON TEES","Atlas Healthcare Ltd","15/08/2011","Good",2015-01-20,1,"2014-01-01","2021-03-05",NA
"158","Local Authority","SC034205",3,"NORTH YORKSHIRE",NA,NA,"Good",2015-01-20,1,"2014-01-01","2015-04-07",NA
"159","Local Authority","SC032600",5,"HOUNSLOW","London Borough of Hounslow","01/08/2003","Good",2015-01-20,1,"2014-01-01",NA,NA
"160","For-profit","SC457012",3,"ESSEX","Cambian Childcare Ltd","22/02/2013","Good",2015-01-20,1,"2014-01-01",NA,NA
"161","Local Authority","SC439282",4,"KENT","Kent County Council","20/02/2012","Good",2015-01-20,1,"2014-01-01",NA,NA
"162","Local Authority","SC033367",6,"KIRKLEES","Kirklees Council","07/10/2003","Good",2015-01-19,1,"2014-01-01",NA,NA
"163","Local Authority","SC033432",6,"BLACKPOOL","Blackpool Borough Council","24/10/2003","Outstanding",2015-01-19,1,"2014-01-01","2020-04-29",NA
"164","For-profit","SC434100",3,"ENFIELD",NA,NA,"Inadequate",2015-01-19,1,"2014-01-01","2016-11-07",NA
"165","For-profit","SC405448",5,"KNOWSLEY","Quality Protects Children Ltd","20/04/2010","Good",2015-01-19,1,"2014-01-01",NA,NA
"166","Local Authority","SC040719",3,"BOLTON","Bolton Metropolitan Borough Council","18/07/2003","Outstanding",2015-01-18,1,"2014-01-01",NA,NA
"167","For-profit","SC362094",2,"SHROPSHIRE","New Horizons Childcare Ltd","19/11/2007","Good",2015-01-16,1,"2014-01-01",NA,NA
"168","For-profit","SC063689",6,"KENT","The Drive Care Homes Ltd","29/09/2005","Good",2015-01-16,1,"2014-01-01",NA,NA
"169","For-profit","SC066821",14,"CUMBRIA","Cambian Whinfell School Ltd","18/04/2006","Outstanding",2015-01-16,1,"2014-01-01",NA,NA
"170","For-profit","SC419334",4,"BROMLEY","Castle Homes Limited","18/11/2010","Good",2015-01-16,1,"2014-01-01",NA,NA
"171","Local Authority","SC369857",5,"BOLTON","Bolton Metropolitan Borough Council","18/06/2008","Outstanding",2015-01-15,1,"2014-01-01",NA,NA
"172","For-profit","SC414369",2,"CUMBRIA",NA,NA,"Good",2015-01-15,1,"2014-01-01","2015-11-12",NA
"173","For-profit","SC464809",5,"LANCASHIRE","Roc Northwest Ltd","25/06/2013","Good",2015-01-15,1,"2014-01-01",NA,NA
"174","For-profit","SC028526",2,"EAST SUSSEX","Anderida Adolescent Care","01/05/2002","Outstanding",2015-01-15,1,"2014-01-01",NA,NA
"175","For-profit","SC420876",4,"STAFFORDSHIRE","Prestige Adolescent Care And Education Limited","20/12/2010","Good",2015-01-15,1,"2014-01-01",NA,NA
"176","Local Authority","SC040633",5,"SURREY","Surrey County Council","05/12/2003","Outstanding",2015-01-15,1,"2014-01-01",NA,NA
"177","Local Authority","SC442279",4,"GLOUCESTERSHIRE",NA,NA,"Outstanding",2015-01-15,1,"2014-01-01","2016-02-08",NA
"178","Third Sector","SC035241",5,"DONCASTER","Doncaster Deaf Trust","13/06/2003","Good",2015-01-14,1,"2014-01-01",NA,NA
"179","For-profit","SC429011",3,"BUCKINGHAMSHIRE","Keys Care Limited","02/06/2011","Good",2015-01-14,1,"2014-01-01",NA,NA
"180","For-profit","SC429748",4,"SUFFOLK","The Ryes College Limited","22/07/2011","Good",2015-01-14,1,"2014-01-01",NA,NA
"181","Local Authority","SC431696",10,"BRADFORD","Bradford Childrens Specialist Service","10/06/2011","Good",2015-01-14,1,"2014-01-01",NA,NA
"182","For-profit","SC433923",4,"HEREFORDSHIRE","Greenfields Adolescent Development Limited",NA,"Inadequate",2015-01-14,1,"2014-01-01","2018-10-01",NA
"183","For-profit","SC462951",3,"ESSEX","ERA Care Limited 5921904","28/06/2013","Good",2015-01-14,1,"2014-01-01",NA,NA
"184","For-profit","SC467004",5,"BRENT","Aspire House Partnership",NA,"Inadequate",2015-01-14,1,"2014-01-01","2018-05-31",NA
"185","Third Sector","SC020563",5,"TELFORD AND WREKIN",NA,NA,"Good",2015-01-14,1,"2014-01-01","2016-03-31",NA
"186","For-profit","SC480236",4,"LANCASHIRE",NA,NA,"Good",2015-01-14,1,"2014-10-30","2017-09-13",NA
"187","For-profit","SC063498",1,"ST HELENS","Crossway Services Limited","17/01/2005","Good",2015-01-14,1,"2014-01-01",NA,NA
"188","Local Authority","SC034609",6,"ISLINGTON",NA,NA,"Good",2015-01-14,1,"2014-01-01","2016-07-25",NA
"189","For-profit","SC356327",3,"STAFFORDSHIRE","Oracle Care Limited","03/07/2007","Good",2015-01-14,1,"2014-01-01",NA,NA
"190","Third Sector","SC424271",4,"NORFOLK","Break","02/02/2011","Good",2015-01-14,1,"2014-01-01",NA,NA
"191","For-profit","SC425599",1,"SHROPSHIRE",NA,NA,"Good",2015-01-14,1,"2014-01-01","2015-07-31",NA
"192","Third Sector","SC426172",6,"HERTFORDSHIRE","Action For Children","06/04/2011","Good",2015-01-14,1,"2014-01-01","2022-03-31",NA
"193","Local Authority","SC041018",6,"WIGAN",NA,NA,"Good",2015-01-14,1,"2014-01-01","2016-07-31",NA
"194","For-profit","SC387148",5,"TRAFFORD","Fairfield Residential Ltd","01/12/2008","Good",2015-01-14,1,"2014-01-01",NA,NA
"195","For-profit","SC408656",4,"REDCAR AND CLEVELAND","Highfield (North East) Limited","01/06/2010","Outstanding",2015-01-14,1,"2014-01-01",NA,NA
"196","For-profit","SC457327",3,"SOMERSET","Cambian Childcare Ltd","22/02/2013","Good",2015-01-14,1,"2014-01-01",NA,NA
"197","For-profit","SC023739",3,"KENT","Ethelbert Specialist Homes Limited","11/07/2001","Good",2015-01-13,1,"2014-01-01",NA,NA
"198","For-profit","SC413678",2,"KINGSTON UPON HULL","Horton Establishments Ltd","12/07/2011","Good",2015-01-13,1,"2014-01-01","2021-09-13",NA
"199","For-profit","SC464532",3,"EALING","Alicie Enterprises Limited",NA,"Inadequate",2015-01-13,1,"2014-01-01","2019-02-27",NA
"200","Local Authority","SC470513",52,"KENT","Bradstow School (Wandsworth Local Authority)","07/01/2014","Good",2015-01-13,1,"2014-01-01",NA,NA
"201","For-profit","SC472325",2,"STAFFORDSHIRE","Aspireone Care Ltd","25/01/2014","Good",2015-01-13,1,"2014-01-01",NA,NA
"202","Third Sector","SC025700",8,"NORFOLK","Institute of Integrated Systemic Therapy","23/07/1999","Outstanding",2015-01-13,1,"2014-01-01",NA,NA
"203","For-profit","SC029865",3,"WEST SUSSEX","My Choice Children's Homes Ltd","30/12/2002","Good",2015-01-13,1,"2014-01-01",NA,NA
"204","Local Authority","SC034235",6,"NORTH YORKSHIRE","North Yorkshire County Council","14/10/2003","Good",2015-01-13,1,"2014-01-01",NA,NA
"205","For-profit","SC452107",3,"CAMBRIDGESHIRE","Semi-Independent House Limited","03/12/2012","Good",2015-01-13,1,"2014-01-01",NA,NA
"206","Local Authority","SC356868",5,"SHEFFIELD","Sheffield City Council","15/08/2007","Good",2015-01-13,1,"2014-01-01",NA,NA
"207","Third Sector","SC420587",4,"SOUTH TYNESIDE",NA,NA,"Good",2015-01-13,1,"2014-01-01","2017-09-28",NA
"208","Local Authority","SC061045",4,"DORSET",NA,NA,"Good",2015-01-12,1,"2014-01-01","2017-10-02",NA
"209","Third Sector","SC025739",4,"STOCKPORT","The Together Trust","24/07/1998","Good",2015-01-12,1,"2014-01-01",NA,NA
"210","For-profit","SC403411",4,"HOUNSLOW",NA,NA,"Inadequate",2015-01-12,1,"2014-01-01","2016-10-11",NA
"211","For-profit","SC067238",5,"STOCKPORT",NA,NA,"Good",2015-01-12,1,"2014-01-01","2017-06-30",NA
"212","For-profit","SC436386",4,"LINCOLNSHIRE","Knossington Grange School Ltd","16/09/2011","Good",2015-01-12,1,"2014-01-01",NA,NA
"213","Local Authority","SC035220",3,"DURHAM","Durham County Council","05/09/2003","Good",2015-01-09,1,"2014-01-01",NA,NA
"214","For-profit","SC389781",8,"TOWER HAMLETS","The Qalb Short Break Services Ltd","11/02/2009","Good",2015-01-09,1,"2014-01-01",NA,NA
"215","Local Authority","SC038500",4,"DUDLEY","Dudley Metropolitan Borough Council","22/04/2003","Outstanding",2015-01-08,1,"2014-01-01","2022-05-28",NA
"216","Local Authority","SC059842",5,"BOLTON","Bolton Metropolitan Borough Council","10/03/2004","Outstanding",2015-01-07,1,"2014-01-01",NA,NA
"217","Local Authority","SC035380",6,"STOCKTON ON TEES","Stockton on Tees Borough Council","25/03/2003","Good",2015-01-07,1,"2014-01-01",NA,NA
"218","Local Authority","SC038237",5,"DARLINGTON","Darlington Borough Council","05/09/2003","Good",2015-01-07,1,"2014-01-01",NA,NA
"219","For-profit","SC430320",5,"BARKING AND DAGENHAM","The Vine Residential Services (TVRS) Ltd","09/08/2011","Good",2015-01-07,1,"2014-01-01",NA,NA
"220","Third Sector","SC025718",4,"NORFOLK","Break","16/11/1995","Good",2015-01-07,1,"2014-01-01",NA,NA
"221","Local Authority","SC036009",6,"SHEFFIELD","Sheffield City Council","22/04/2003","Good",2015-01-07,1,"2014-01-01",NA,NA
"222","Local Authority","SC066277",9,"HAMPSHIRE","Hampshire County Council","16/02/2006","Good",2015-01-07,1,"2014-01-01","2022-11-01",NA
"223","For-profit","SC401685",23,"STAFFORDSHIRE","Priory Education Services Limited 06244880","16/03/2010","Good",2015-01-07,1,"2014-01-01",NA,NA
"224","For-profit","SC042590",4,"MIDDLESBROUGH","A J Residential Care Ltd",NA,"Good",2015-01-07,1,"2014-01-01","2018-04-22",NA
"225","For-profit","SC067895",3,"KENT","Channels and Choices Kent LLP","21/08/2006","Good",2015-01-07,1,"2014-01-01",NA,NA
"226","Third Sector","SC422415",1,"BEDFORD","St Christopher's Fellowship","21/02/2011","Good",2015-01-07,1,"2014-01-01","2020-01-31",NA
"227","For-profit","SC426318",2,"STOKE ON TRENT","Unity Residential Care Services","02/04/2011","Outstanding",2015-01-07,1,"2014-01-01",NA,NA
"228","For-profit","SC408149",2,"DEVON","Phoenix Child Care Limited","25/02/2010","Good",2015-01-07,1,"2014-01-01",NA,NA
"229","For-profit","SC436818",3,"NOTTINGHAM","Grace Care Limited","20/02/2012","Good",2015-01-07,1,"2014-01-01",NA,NA
"230","For-profit","SC476252",5,"SHROPSHIRE","Cambian Childcare Ltd","09/03/2014","Good",2015-01-07,1,"2014-01-01",NA,NA
"231","For-profit","SC023646",8,"KENT","Acorn Homes (UK) Limited","06/07/1998","Good",2015-01-06,1,"2014-01-01",NA,NA
"232","For-profit","SC023746",3,"KENT","Ethelbert Specialist Homes Limited","26/06/2001","Good",2015-01-06,1,"2014-01-01",NA,NA
"233","Local Authority","SC038557",5,"NORTH TYNESIDE","North Tyneside Council","06/06/2003","Good",2015-01-06,1,"2014-01-01",NA,NA
"234","For-profit","SC390576",4,"WOLVERHAMPTON","The Partnership of Care Today Children's Services","29/04/2009","Good",2015-01-06,1,"2014-01-01",NA,NA
"235","For-profit","SC461846",6,"ESSEX","Pathways Care Group Limited","25/04/2013","Outstanding",2015-01-06,1,"2014-01-01",NA,NA
"236","Local Authority","SC465287",6,"NORTHAMPTONSHIRE","Northamptonshire Healthcare NHS Foundation Trust","22/07/2013","Good",2015-01-06,1,"2014-01-01",NA,NA
"237","Local Authority","SC034480",4,"NORFOLK","Norfolk County Council Children's Services","24/12/2003","Good",2015-01-06,1,"2014-01-01",NA,NA
"238","For-profit","SC405649",3,"GLOUCESTERSHIRE","Utopia Children's Services Ltd",NA,"Good",2015-01-06,1,"2014-01-01","2018-05-14",NA
"239","For-profit","SC022445",1,"ST HELENS",NA,NA,"Good",2015-01-06,1,"2014-01-01","2017-09-11",NA
"240","Local Authority","SC032475",5,"TRAFFORD","Trafford Borough Council","09/12/2003","Outstanding",2015-01-06,1,"2014-01-01",NA,NA
"241","For-profit","SC067839",2,"STAFFORDSHIRE","Future In Mind Limited","28/06/2006","Good",2015-01-06,1,"2014-01-01",NA,NA
"242","Third Sector","SC365647",3,"HERTFORDSHIRE",NA,NA,"Good",2015-01-06,1,"2014-01-01","2016-09-30",NA
"243","For-profit","SC423382",2,"SOMERSET",NA,NA,"Good",2015-01-06,1,"2014-01-01","2015-07-14",NA
"244","For-profit","SC457254",5,"CUMBRIA","North Lakes Children's Services Limited","13/12/2012","Outstanding",2015-01-06,1,"2014-01-01",NA,NA
"245","Local Authority","SC062128",6,"HOUNSLOW","London Borough of Hounslow","12/11/2004","Good",2015-01-06,1,"2014-01-01",NA,NA
"246","For-profit","SC062931",3,"KENT","Channels and Choices Kent LLP","08/04/2005","Good",2015-01-06,1,"2014-01-01",NA,NA
"247","For-profit","SC458352",3,"DEVON","Cambian Childcare Ltd","14/03/2013","Good",2015-01-06,1,"2014-01-01",NA,NA
"248","Local Authority","SC045408",2,"SURREY","Surrey County Council","19/11/2003","Good",2015-01-05,1,"2014-01-01",NA,NA
"249","Local Authority","SC040266",5,"WIGAN","Wigan Council","15/08/2003","Outstanding",2015-01-05,1,"2014-01-01",NA,NA
"250","Local Authority","SC034686",5,"DURHAM","Durham County Council","05/09/2003","Good",2015-01-05,1,"2014-01-01",NA,NA
"251","For-profit","SC384924",2,"KIRKLEES","Rosedale Children's Services Limited","20/10/2008","Outstanding",2015-01-05,1,"2014-01-01","2020-11-30",NA
"252","Local Authority","SC037282",7,"KENT","Kent County Council","03/09/2002","Good",2015-01-05,1,"2014-01-01",NA,NA
"253","For-profit","SC394875",2,"STAFFORDSHIRE","Future In Mind Limited","30/06/2009","Good",2014-12-31,1,"2014-01-01",NA,NA
"254","Local Authority","SC036186",8,"DERBYSHIRE","Derbyshire County Council","11/12/2003","Good",2014-12-31,1,"2014-01-01",NA,NA
"255","For-profit","SC438427",2,"TELFORD AND WREKIN","MGM Care Services Ltd","30/12/2011","Good",2014-12-31,1,"2014-01-01",NA,NA
"256","For-profit","SC023740",3,"KENT","Ethelbert Specialist Homes Limited","17/07/2001","Outstanding",2014-12-30,1,"2014-01-01",NA,NA
"257","Local Authority","SC033127",11,"NORTH EAST LINCOLNSHIRE","North East Lincolnshire Council","20/01/2004","Outstanding",2014-12-30,1,"2014-01-01",NA,NA
"258","Local Authority","SC030713",5,"WOKINGHAM","Wokingham Borough Council","13/05/2004","Outstanding",2014-12-30,1,"2014-01-01",NA,NA
"259","For-profit","SC456857",1,"ROCHDALE","Cambian Childcare Ltd","11/02/2013","Outstanding",2014-12-30,1,"2014-01-01",NA,NA
"260","Third Sector","SC459244",6,"NEWCASTLE UPON TYNE","St Cuthbert's Care","15/02/2013","Good",2014-12-29,1,"2014-01-01","2020-07-22",NA
"261","For-profit","SC061485",3,"PETERBOROUGH",NA,NA,"Good",2014-12-23,1,"2014-01-01","2015-05-01",NA
"262","Local Authority","SC035976",4,"DERBYSHIRE","Derbyshire County Council","22/12/2003","Good",2014-12-23,1,"2014-01-01",NA,NA
"263","Local Authority","SC356781",8,"WORCESTERSHIRE","Worcestershire County Council","01/06/2007","Good",2014-12-23,1,"2014-01-01","2019-10-01",NA
"264","For-profit","SC419229",3,"BIRMINGHAM","Care And Management Services Limited","02/11/2010","Good",2014-12-23,1,"2014-01-01",NA,NA
"265","Local Authority","SC038564",6,"NORTH TYNESIDE","North Tyneside Council","25/06/2003","Good",2014-12-22,1,"2014-01-01",NA,NA
"266","Local Authority","SC036298",7,"SEFTON","Sefton Metropolitan Borough Council","20/01/2004","Good",2014-12-22,1,"2014-01-01",NA,NA
"267","Local Authority","SC032315",5,"BRIGHTON AND HOVE","Brighton & Hove City Council","05/08/2003","Outstanding",2014-12-22,1,"2014-01-01",NA,NA
"268","For-profit","SC411074",2,"STOKE ON TRENT","Searchlight Care Services Ltd","07/06/2010","Outstanding",2014-12-22,1,"2014-01-01",NA,NA
"269","For-profit","SC464650",2,"SEFTON",NA,NA,"Good",2014-12-19,1,"2014-01-01","2017-04-04",NA
"270","For-profit","SC001452",8,"LEEDS","Five Rivers Child Care Limited","01/04/2002","Good",2014-12-19,1,"2014-01-01",NA,NA
"271","Third Sector","SC454294",4,"KENT","Institute of Integrated Systemic Therapy","02/11/2012","Good",2014-12-19,1,"2014-01-01",NA,NA
"272","For-profit","SC456149",6,"WARRINGTON","Bright Futures Care Limited T/A Cornerstones","31/10/2012","Good",2014-12-19,1,"2014-01-01",NA,NA
"273","For-profit","SC373693",3,"STAFFORDSHIRE","Pine Forest Homes Limited","13/05/2008","Good",2014-12-19,1,"2014-01-01","2019-12-12",NA
"274","Local Authority","SC034940",8,"YORK","City Of York Council","14/10/2003","Good",2014-12-19,1,"2014-01-01","2020-11-20",NA
"275","For-profit","SC411616",3,"WOKINGHAM","Calcot Services For Children Limited","17/06/2010","Outstanding",2014-12-19,1,"2014-01-01","2022-08-01",NA
"276","For-profit","SC438624",2,"WINDSOR AND MAIDENHEAD","Keys Care Limited","01/11/2011","Good",2014-12-19,1,"2014-01-01",NA,NA
"277","Local Authority","SC060332",4,"WORCESTERSHIRE","Worcestershire County Council","28/05/2004","Good",2014-12-18,1,"2014-01-01","2019-10-01",NA
"278","Local Authority","SC035428",4,"LANCASHIRE","Lancashire County Council","05/01/2004","Good",2014-12-18,1,"2014-01-01",NA,NA
"279","Third Sector","SC030367",42,"GLOUCESTERSHIRE","Cotswold Chine School","01/10/2003","Good",2014-12-18,1,"2014-01-01",NA,NA
"280","For-profit","SC478852",3,"STAFFORDSHIRE","Roundhouse Care Ltd","25/06/2014","Good",2014-12-18,1,"2014-06-25",NA,NA
"281","For-profit","SC378181",2,"STAFFORDSHIRE","Platinum Services For Children (residential Care) Ltd","09/09/2008","Good",2014-12-18,1,"2014-01-01","2022-06-17",NA
"282","For-profit","SC411194",4,"LEICESTERSHIRE",NA,NA,"Good",2014-12-18,1,"2014-01-01","2015-10-01",NA
"283","Local Authority","SC437069",6,"DERBYSHIRE","Derbyshire County Council","09/11/2011","Outstanding",2014-12-18,1,"2014-01-01",NA,NA
"284","Local Authority","SC458141",6,"HERTFORDSHIRE","Hertfordshire County Council","10/01/2013","Good",2014-12-18,1,"2014-01-01",NA,NA
"285","Local Authority","SC059635",8,"BRADFORD","Bradford Childrens Specialist Service","11/03/2004","Good",2014-12-17,1,"2014-01-01",NA,NA
"286","For-profit","SC413106",6,"KENT","Castle Homes Limited","23/06/2010","Good",2014-12-17,1,"2014-01-01","2019-04-30",NA
"287","Local Authority","SC036383",6,"OXFORDSHIRE","Oxfordshire County Council","24/03/2003","Good",2014-12-17,1,"2014-01-01","2019-05-04",NA
"288","Local Authority","SC040505",6,"SALFORD","Salford City Council","23/03/2004","Outstanding",2014-12-17,1,"2014-01-01","2019-04-23",NA
"289","For-profit","SC066393",3,"BIRMINGHAM","Cambian Childcare Ltd","18/01/2006","Good",2014-12-17,1,"2014-01-01",NA,NA
"290","For-profit","SC359818",4,"WOLVERHAMPTON","Cambian Childcare Ltd","30/03/2007","Good",2014-12-17,1,"2014-01-01",NA,NA
"291","For-profit","SC360834",4,"DEVON",NA,NA,"Good",2014-12-17,1,"2014-01-01","2016-10-06",NA
"292","For-profit","SC382159",5,"GREENWICH",NA,NA,"Good",2014-12-17,1,"2014-01-01","2017-07-31",NA
"293","For-profit","SC063116",6,"KENT","Ethelbert Specialist Homes Limited","01/12/2004","Outstanding",2014-12-17,1,"2014-01-01",NA,NA
"294","Third Sector","SC063814",4,"NORFOLK","Break","11/07/2005","Good",2014-12-17,1,"2014-01-01",NA,NA
"295","For-profit","SC064027",6,"STAFFORDSHIRE","Delam Care Limited","03/05/2005","Good",2014-12-17,1,"2014-01-01",NA,NA
"296","Local Authority","SC065883",9,"NORFOLK","Norfolk County Council Children's Services","14/10/2005","Outstanding",2014-12-17,1,"2014-01-01",NA,NA
"297","For-profit","SC355839",2,"BARNSLEY","Dove Adolescent Services Limited","02/07/2007","Outstanding",2014-12-17,1,"2014-01-01",NA,NA
"298","For-profit","SC356864",2,"BURY","Time-Out Childrens Homes Limited","27/03/2007","Good",2014-12-17,1,"2014-01-01",NA,NA
"299","For-profit","SC374268",3,"SANDWELL","Keys Care Limited","17/07/2008","Good",2014-12-17,1,"2014-01-01",NA,NA
"300","For-profit","SC396721",1,"SHROPSHIRE","Reflexion Care Group Limited","25/06/2009","Good",2014-12-17,1,"2014-01-01",NA,NA
"301","For-profit","SC062651",4,"SUFFOLK","Care Focus Limited","10/12/2004","Good",2014-12-17,1,"2014-01-01",NA,NA
"302","For-profit","SC390156",3,"KENT","Pilgrims Corner Limited","30/06/2009","Good",2014-12-17,1,"2014-01-01","2022-10-10",NA
"303","For-profit","SC059945",3,"LANCASHIRE","Pathfinders (childcare) Ltd","17/05/2004","Outstanding",2014-12-16,1,"2014-01-01","2020-02-26",NA
"304","Local Authority","SC428956",2,"CORNWALL","Cornwall Partnership NHS Foundation Trust","26/08/2011","Good",2014-12-16,1,"2014-01-01",NA,NA
"305","Local Authority","SC033919",5,"HARROW","London Borough of Harrow","17/11/2003","Outstanding",2014-12-16,1,"2014-01-01",NA,NA
"306","For-profit","SC479596",7,"NORTH EAST LINCOLNSHIRE","Tree House Care Fostering Solutions Ltd","22/07/2014","Good",2014-12-16,1,"2014-07-22",NA,NA
"307","For-profit","SC403472",5,"NEWCASTLE UPON TYNE","Artemis Support Ltd","11/05/2010","Outstanding",2014-12-16,1,"2014-01-01",NA,NA
"308","For-profit","SC008274",2,"STOKE ON TRENT","Searchlight Care Services Ltd","18/04/2001","Outstanding",2014-12-16,1,"2014-01-01",NA,NA
"309","For-profit","SC021677",4,"MANCHESTER","The Partnership of Care Today Children's Services","24/08/2001","Good",2014-12-16,1,"2014-01-01",NA,NA
"310","For-profit","SC456474",6,"KINGSTON UPON HULL","Cambian Childcare Ltd","02/12/2013","Good",2014-12-16,1,"2014-01-01",NA,NA
"311","For-profit","SC066917",2,"STAFFORDSHIRE","Oracle Care Limited","30/05/2006","Outstanding",2014-12-16,1,"2014-01-01",NA,NA
"312","For-profit","SC363403",4,"LINCOLNSHIRE","Broadwood Education Services","10/10/2007","Good",2014-12-16,1,"2014-01-01",NA,NA
"313","For-profit","SC421844",6,"BIRMINGHAM",NA,NA,"Inadequate",2014-12-16,1,"2014-01-01","2015-08-10",NA
"314","Third Sector","SC424089",14,"BUCKINGHAMSHIRE","Action For Children","14/03/2011","Good",2014-12-16,1,"2014-01-01",NA,NA
"315","For-profit","SC006011",2,"LANCASHIRE","Doncaster Deaf Trust","20/06/2001","Good",2014-12-16,1,"2014-01-01","2022-02-09",NA
"316","Local Authority","SC442779",2,"WARRINGTON","Warrington Borough Council","05/03/2012","Good",2014-12-16,1,"2014-01-01",NA,NA
"317","For-profit","SC428700",3,"SHEFFIELD","Pathway Care Solutions Ii Ltd","30/06/2011","Good",2014-12-15,1,"2014-01-01",NA,NA
"318","For-profit","SC028460",4,"HARINGEY","","30/04/2002","Good",2014-12-15,1,"2014-01-01",NA,NA
"319","For-profit","SC362965",1,"DORSET","Five Rivers Child Care Limited","28/11/2007","Good",2014-12-15,1,"2014-01-01",NA,NA
"320","For-profit","SC007290",4,"WALTHAM FOREST","","27/10/1998","Good",2014-12-15,1,"2014-01-01",NA,NA
"321","For-profit","SC475578",3,"TELFORD AND WREKIN",NA,NA,"Good",2014-12-15,1,"2014-05-15","2016-09-19",NA
"322","Local Authority","SC415138",6,"STAFFORDSHIRE","Staffordshire County Council","12/07/2010","Outstanding",2014-12-12,1,"2014-01-01",NA,NA
"323","Local Authority","SC066214",6,"WALSALL","Walsall Metropolitan Borough Council","09/02/2006","Good",2014-12-12,1,"2014-01-01","2019-06-30",NA
"324","Third Sector","SC403493",6,"SOMERSET","Blackford Education (schools) Ltd","24/11/2009","Outstanding",2014-12-12,1,"2014-01-01","2020-02-28",NA
"325","Third Sector","SC446957",4,"SUNDERLAND","North East Autism Society","28/05/2012","Good",2014-12-12,1,"2014-01-01","2022-08-25",NA
"326","Local Authority","SC040926",6,"WIGAN","Wigan Council","30/05/2003","Good",2014-12-12,1,"2014-01-01",NA,NA
"327","Local Authority","SC052599",10,"MILTON KEYNES","Milton Keynes Council","26/03/2004","Good",2014-12-12,1,"2014-01-01",NA,NA
"328","For-profit","SC389649",3,"MANCHESTER","Cambian Childcare Ltd","18/02/2009","Outstanding",2014-12-12,1,"2014-01-01","2020-12-20",NA
"329","For-profit","SC411825",2,"WIGAN","Inspire Childrens Services Limited","17/06/2010","Outstanding",2014-12-12,1,"2014-01-01",NA,NA
"330","For-profit","SC009651",4,"LANCASHIRE","Keys Childcare Ltd","08/02/1996","Good",2014-12-11,1,"2014-01-01",NA,NA
"331","For-profit","SC392602",3,"CUMBRIA",NA,NA,"Good",2014-12-11,1,"2014-01-01","2017-02-15",NA
"332","Local Authority","SC039673",6,"LANCASHIRE","Lancashire County Council","19/08/2003","Good",2014-12-11,1,"2014-01-01",NA,NA
"333","Local Authority","SC032253",6,"EALING","London Borough of Ealing",NA,"Good",2014-12-11,1,"2014-01-01","2018-05-13",NA
"334","Local Authority","SC032502",13,"HILLINGDON","The London Borough of Hillingdon","17/11/2003","Good",2014-12-11,1,"2014-01-01",NA,NA
"335","For-profit","SC456157",6,"WARRINGTON","Bright Futures Care Limited T/A Cornerstones","31/10/2012","Outstanding",2014-12-11,1,"2014-01-01",NA,NA
"336","Third Sector","SC400901",6,"NORFOLK","Break","21/01/2010","Good",2014-12-11,1,"2014-01-01",NA,NA
"337","Local Authority","SC456710",4,"STOCKTON ON TEES","Stockton on Tees Borough Council","08/11/2012","Good",2014-12-11,1,"2014-01-01",NA,NA
"338","For-profit","SC457137",1,"DEVON","Cambian Childcare Ltd","14/03/2013","Good",2014-12-11,1,"2014-01-01",NA,NA
"339","For-profit","SC410535",3,"BIRMINGHAM","Positive Pathways Limited","19/07/2010","Outstanding",2014-12-11,1,"2014-01-01",NA,NA
"340","For-profit","SC438648",2,"KENT","Benecare Limited","14/12/2011","Good",2014-12-11,1,"2014-01-01",NA,NA
"341","For-profit","SC475748",7,"LANCASHIRE","Witherslack Group Ltd","30/06/2014","Good",2014-12-11,1,"2014-06-30",NA,NA
"342","For-profit","SC023645",7,"KENT","Acorn Homes (UK) Limited","05/07/2000","Good",2014-12-10,1,"2014-01-01",NA,NA
"343","Local Authority","SC037984",3,"DARLINGTON","Darlington Borough Council","05/09/2003","Good",2014-12-10,1,"2014-01-01",NA,NA
"344","For-profit","SC064934",3,"BARNSLEY","Dove Adolescent Services Limited","28/12/2005","Outstanding",2014-12-10,1,"2014-01-01",NA,NA
"345","For-profit","SC390751",5,"DARLINGTON","Acorn Care (UK) Limited","22/04/2009","Good",2014-12-10,1,"2014-01-01",NA,NA
"346","For-profit","SC392712",2,"NOTTINGHAMSHIRE","Capstone Care Provider Limited","13/05/2009","Good",2014-12-10,1,"2014-01-01",NA,NA
"347","For-profit","SC413078",2,"NOTTINGHAMSHIRE","Castle Homes Care Ltd","28/07/2010","Good",2014-12-10,1,"2014-01-01","2021-09-01",NA
"348","Local Authority","SC033486",8,"BRADFORD",NA,NA,"Good",2014-12-10,1,"2014-01-01","2017-09-25",NA
"349","For-profit","SC047894",4,"SUFFOLK","Care Focus Limited","26/09/2003","Good",2014-12-10,1,"2014-01-01",NA,NA
"350","For-profit","SC480671",8,"LANCASHIRE","Hexagon Care Services Limited","23/10/2014","Good",2014-12-10,1,"2014-10-23",NA,NA
"351","Local Authority","SC066549",2,"TRAFFORD",NA,NA,"Good",2014-12-10,1,"2014-01-01","2016-04-30",NA
"352","For-profit","SC362170",3,"STOKE ON TRENT","Searchlight Care Services Ltd","17/01/2008","Outstanding",2014-12-10,1,"2014-01-01",NA,NA
"353","For-profit","SC383941",4,"WORCESTERSHIRE","Archways Care Ltd","23/12/2008","Good",2014-12-10,1,"2014-01-01","2022-11-18",NA
"354","For-profit","SC405977",2,"TELFORD AND WREKIN","Reflexion Care Group Limited","15/01/2010","Good",2014-12-10,1,"2014-01-01",NA,NA
"355","Local Authority","SC038719",16,"HAMPSHIRE","Hampshire County Council","31/03/2004","Good",2014-12-10,1,"2014-01-01",NA,NA
"356","For-profit","SC417031",4,"DURHAM","Pathways Care Group Limited","03/12/2010","Good",2014-12-10,1,"2014-01-01",NA,NA
"357","For-profit","SC385809",3,"HAMPSHIRE","Fairways Care (uk) Limited","04/12/2008","Good",2014-12-10,1,"2014-01-01",NA,NA
"358","For-profit","SC397562",5,"NORTHAMPTONSHIRE",NA,NA,"Outstanding",2014-12-10,1,"2014-01-01","2017-05-24",NA
"359","Local Authority","SC040628",8,"SURREY","Surrey County Council","10/10/2003","Good",2014-12-10,1,"2014-01-01","2022-02-21",NA
"360","Local Authority","SC442777",3,"WARRINGTON","Warrington Borough Council","19/03/2012","Outstanding",2014-12-10,1,"2014-01-01",NA,NA
"361","Local Authority","SC068929",8,"ESSEX","Essex County Council","01/02/2007","Good",2014-12-09,1,"2014-01-01",NA,NA
"362","For-profit","SC431228",6,"NORFOLK","Unique Care Homes Support Limited","01/09/2011","Good",2014-12-09,1,"2014-01-01",NA,NA
"363","Local Authority","SC432404",2,"CORNWALL","Cornwall Partnership NHS Foundation Trust","08/09/2011","Good",2014-12-09,1,"2014-01-01",NA,NA
"364","For-profit","SC461865",5,"REDBRIDGE","Heartwood RSW Ltd","08/11/2013","Good",2014-12-09,1,"2014-01-01",NA,NA
"365","For-profit","SC043814",3,"TELFORD AND WREKIN","Educare Adolescent Services Limited","23/04/2003","Outstanding",2014-12-09,1,"2014-01-01","2020-03-09",NA
"366","Local Authority","SC031980",6,"BOURNEMOUTH",NA,NA,"Good",2014-12-09,1,"2014-01-01","2017-09-01",NA
"367","For-profit","SC444352",4,"WOLVERHAMPTON","Cambian Childcare Ltd",NA,"Good",2014-12-09,1,"2014-01-01","2018-04-06",NA
"368","For-profit","SC376719",2,"SHROPSHIRE","Reflexion Care Group Limited","26/06/2008","Good",2014-12-09,1,"2014-01-01",NA,NA
"369","For-profit","SC394909",6,"NEWCASTLE UPON TYNE","Right-Trak Limited","24/06/2009","Good",2014-12-08,1,"2014-01-01",NA,NA
"370","For-profit","SC403789",4,"WORCESTERSHIRE","Cove Care Residential Ltd","31/08/2010","Good",2014-12-08,1,"2014-01-01",NA,NA
"371","Local Authority","SC032517",6,"HILLINGDON","London Borough of Hillingdon",NA,"Good",2014-12-08,1,"2014-01-01","2018-09-01",NA
"372","For-profit","SC366104",3,"STAFFORDSHIRE","Reflexion Care Group Limited","20/12/2007","Good",2014-12-08,1,"2014-01-01",NA,NA
"373","For-profit","SC355755",1,"WAKEFIELD","Dove Adolescent Services Limited","14/06/2007","Good",2014-12-08,1,"2014-01-01",NA,NA
"374","Local Authority","SC375911",6,"STAFFORDSHIRE","Staffordshire County Council","29/05/2008","Good",2014-12-08,1,"2014-01-01",NA,NA
"375","Local Authority","SC044692",4,"NOTTINGHAMSHIRE","Nottinghamshire County Council","04/05/2005","Good",2014-12-05,1,"2014-01-01",NA,NA
"376","Local Authority","SC035439",6,"LANCASHIRE","Lancashire County Council","03/11/2003","Outstanding",2014-12-05,1,"2014-01-01",NA,NA
"377","For-profit","SC393228",4,"GLOUCESTERSHIRE","Marlowe Child & Family Services Limited",NA,"Good",2014-12-05,1,"2014-01-01","2018-06-06",NA
"378","Local Authority","SC063815",4,"WALSALL","Walsall Metropolitan Borough Council","24/08/2005","Outstanding",2014-12-05,1,"2014-01-01",NA,NA
"379","For-profit","SC456953",4,"HEREFORDSHIRE",NA,NA,"Good",2014-12-05,1,"2014-01-01","2015-10-19",NA
"380","Local Authority","SC059801",6,"WORCESTERSHIRE","Worcestershire County Council","02/02/2004","Good",2014-12-04,1,"2014-01-01","2019-04-15",NA
"381","For-profit","SC068770",4,"SUFFOLK",NA,NA,"Good",2014-12-04,1,"2014-01-01","2017-01-30",NA
"382","For-profit","SC068991",4,"CAMBRIDGESHIRE","M.J. Childrens Services Limited","15/01/2007","Good",2014-12-04,1,"2014-01-01",NA,NA
"383","For-profit","SC463431",2,"DEVON","Phoenix Learning And Care Ltd","31/05/2013","Good",2014-12-04,1,"2014-01-01",NA,NA
"384","For-profit","SC066458",3,"LEEDS","Pebbles Care","30/03/2006","Good",2014-12-04,1,"2014-01-01",NA,NA
"385","For-profit","SC020859",6,"WALSALL","Progress Children's Services","21/12/2000","Good",2014-12-04,1,"2014-01-01",NA,NA
"386","Local Authority","SC037256",7,"SUFFOLK","Suffolk County Council","17/03/2003","Good",2014-12-04,1,"2014-01-01",NA,NA
"387","For-profit","SC023745",3,"KENT","Ethelbert Specialist Homes Limited","26/06/2001","Good",2014-12-03,1,"2014-01-01",NA,NA
"388","For-profit","SC068272",9,"WEST SUSSEX","Bramley Care Limited","31/10/2006","Outstanding",2014-12-03,1,"2014-01-01",NA,NA
"389","For-profit","SC368137",2,"DEVON","Phoenix Child Care Limited","10/12/2007","Good",2014-12-03,1,"2014-01-01",NA,NA
"390","For-profit","SC413565",3,"DURHAM",NA,NA,"Good",2014-12-03,1,"2014-01-01","2016-01-14",NA
"391","For-profit","SC065535",6,"LAMBETH","S P Homes Limited","30/09/2005","Good",2014-12-03,1,"2014-01-01",NA,NA
"392","For-profit","SC065541",4,"NORFOLK",NA,NA,"Good",2014-12-03,1,"2014-01-01","2015-11-15",NA
"393","Third Sector","SC015266",6,"CAMBRIDGESHIRE","The Chartwell Group of Companies Limited","13/02/1998","Good",2014-12-03,1,"2014-01-01",NA,NA
"394","Local Authority","SC039056",9,"LEICESTER","Leicester City Council","31/03/2003","Good",2014-12-03,1,"2014-01-01",NA,NA
"395","For-profit","SC029504",4,"NOTTINGHAM","Pathway Care Solutions Ltd 04004053","13/02/2003","Good",2014-12-03,1,"2014-01-01",NA,NA
"396","Local Authority","SC036737",16,"NOTTINGHAMSHIRE","Nottinghamshire County Council","28/11/2003","Outstanding",2014-12-03,1,"2014-01-01",NA,NA
"397","For-profit","SC476570",5,"CAMBRIDGESHIRE","Castle Homes Care Ltd","06/05/2014","Good",2014-12-03,1,"2014-05-06",NA,NA
"398","Local Authority","SC477428",3,"NORTH EAST LINCOLNSHIRE","North East Lincolnshire Council","10/09/2014","Good",2014-12-03,1,"2014-09-10",NA,NA
"399","Local Authority","SC360599",4,"BLACKBURN WITH DARWEN","Blackburn with Darwen Borough Council","27/09/2007","Good",2014-12-03,1,"2014-01-01","2022-09-22",NA
"400","Local Authority","SC379659",5,"LIVERPOOL",NA,NA,"Outstanding",2014-12-03,1,"2014-01-01","2016-02-04",NA
"401","Local Authority","SC042967",7,"LINCOLNSHIRE","Lincolnshire County Council","20/02/2004","Good",2014-12-03,1,"2014-01-01",NA,NA
"402","For-profit","SC008268",2,"STOKE ON TRENT","The Partnership of Care Today Children's Services","01/12/2000","Good",2014-12-03,1,"2014-01-01",NA,NA
"403","For-profit","SC008273",2,"STOKE ON TRENT","Searchlight Care Services Ltd","18/04/2001","Good",2014-12-03,1,"2014-01-01",NA,NA
"404","Local Authority","SC454484",5,"BARNSLEY","Barnsley Metropolitan Borough Council","15/11/2012","Good",2014-12-03,1,"2014-01-01",NA,NA
"405","Local Authority","SC037762",7,"PORTSMOUTH","Portsmouth City Council","06/10/2003","Good",2014-12-03,1,"2014-01-01",NA,NA
"406","For-profit","SC062674",4,"LIVERPOOL","Considerate Care Limited","10/02/2006","Good",2014-12-03,1,"2014-01-01",NA,NA
"407","For-profit","SC006013",1,"LANCASHIRE","Doncaster Deaf Trust","20/06/2001","Good",2014-12-03,1,"2014-01-01",NA,NA
"408","For-profit","SC474041",1,"SHROPSHIRE","New Horizons Childcare Ltd","30/04/2014","Good",2014-12-03,1,"2014-04-30",NA,NA
"409","For-profit","SC457266",3,"DEVON","Cambian Childcare Ltd","21/03/2013","Outstanding",2014-12-03,1,"2014-01-01",NA,NA
"410","For-profit","SC457434",1,"MIDDLESBROUGH","Cambian Childcare Ltd","19/02/2013","Good",2014-12-03,1,"2014-01-01",NA,NA
"411","For-profit","SC458028",3,"ESSEX","Cambian Childcare Ltd","15/02/2013","Good",2014-12-03,1,"2014-01-01",NA,NA
"412","Local Authority","SC035181",6,"DURHAM","Durham County Council","04/09/2003","Good",2014-12-02,1,"2014-01-01",NA,NA
"413","Local Authority","SC466993",3,"WORCESTERSHIRE","Worcestershire County Council","23/07/2013","Good",2014-12-02,1,"2014-01-01","2019-05-08",NA
"414","For-profit","SC025871",7,"CROYDON",NA,NA,"Outstanding",2014-12-02,1,"2014-01-01","2017-12-31",NA
"415","Local Authority","SC033642",6,"NEWCASTLE UPON TYNE","Newcastle City Council","27/02/2003","Outstanding",2014-12-02,1,"2014-01-01",NA,NA
"416","Local Authority","SC034441",8,"KIRKLEES","Kirklees Council","01/10/2003","Outstanding",2014-12-02,1,"2014-01-01",NA,NA
"417","For-profit","SC050176",3,"LEICESTERSHIRE",NA,NA,"Good",2014-12-02,1,"2014-01-01","2017-01-12",NA
"418","Third Sector","SC056054",4,"HAMPSHIRE",NA,NA,"Good",2014-12-02,1,"2014-01-01","2018-03-01",NA
"419","For-profit","SC010090",4,"LANCASHIRE","Partners in Care Limited","21/12/2001","Good",2014-12-01,1,"2014-01-01",NA,NA
"420","Local Authority","SC065067",5,"SALFORD","Salford City Council","01/09/2005","Good",2014-12-01,1,"2014-01-01",NA,NA
"421","For-profit","SC065071",11,"RUTLAND","Hopscotch Solutions Limited","31/10/2005","Good",2014-12-01,1,"2014-01-01",NA,NA
"422","Local Authority","SC028905",5,"STAFFORDSHIRE","Staffordshire County Council","03/07/2003","Good",2014-12-01,1,"2014-01-01",NA,NA
"423","For-profit","SC066187",3,"BIRMINGHAM","Cambian Childcare Ltd","06/02/2006","Good",2014-12-01,1,"2014-01-01",NA,NA
"424","For-profit","SC402426",5,"HEREFORDSHIRE","Priory Education Services Limited 06244880","01/12/2009","Good",2014-12-01,1,"2014-01-01",NA,NA
"425","For-profit","SC062406",3,"STAFFORDSHIRE","Horizon Care Limited","24/01/2005","Good",2014-12-01,1,"2014-01-01","2022-01-10",NA
"426","Local Authority","SC033174",5,"HAMPSHIRE","Hampshire County Council","05/12/2003","Good",2014-11-28,1,"2014-01-01",NA,NA
"427","Local Authority","SC370982",4,"SHROPSHIRE","Shropshire Council","16/06/2008","Outstanding",2014-11-28,1,"2014-01-01",NA,NA
"428","For-profit","SC065378",3,"BIRMINGHAM","Castle Homes Care Ltd","14/12/2005","Good",2014-11-28,1,"2014-01-01",NA,NA
"429","Local Authority","SC034168",7,"CUMBRIA",NA,NA,"Outstanding",2014-11-28,1,"2014-01-01","2017-02-01",NA
"430","Third Sector","SC057804",5,"STAFFORDSHIRE","Action For Children","31/03/2004","Good",2014-11-28,1,"2014-01-01",NA,NA
"431","For-profit","SC451174",2,"MANCHESTER","Cambian Childcare Ltd","26/11/2012","Good",2014-11-28,1,"2014-01-01",NA,NA
"432","For-profit","SC005751",1,"WIGAN","Doncaster Deaf Trust","01/08/2001","Outstanding",2014-11-28,1,"2014-01-01",NA,NA
"433","Local Authority","SC033411",6,"BLACKPOOL","Blackpool Borough Council","05/01/2004","Good",2014-11-27,1,"2014-01-01","2020-07-14",NA
"434","For-profit","SC064764",4,"WORCESTERSHIRE","Marlowe Child & Family Services Limited",NA,"Good",2014-11-27,1,"2014-01-01","2018-06-06",NA
"435","For-profit","SC068205",1,"DEVON","One To One Crisis Intervention Ltd","21/08/2006","Good",2014-11-27,1,"2014-01-01","2022-01-31",NA
"436","For-profit","SC412385",2,"STAFFORDSHIRE","Unity Residential Care Services","25/06/2010","Good",2014-11-27,1,"2014-01-01",NA,NA
"437","For-profit","SC429242",5,"BEDFORD",NA,NA,"Outstanding",2014-11-27,1,"2014-01-01","2017-05-24",NA
"438","For-profit","SC035657",7,"OLDHAM","Cambian Childcare Ltd","21/01/2003","Good",2014-11-27,1,"2014-01-01",NA,NA
"439","Local Authority","SC030967",8,"HARTLEPOOL","Hartlepool Borough Council","17/03/2003","Good",2014-11-27,1,"2014-01-01",NA,NA
"440","Local Authority","SC039900",7,"DUDLEY","Dudley Metropolitan Borough Council","22/04/2003","Good",2014-11-27,1,"2014-01-01",NA,NA
"441","For-profit","SC477853",2,"ST HELENS","Inspire Childrens Services Limited","06/06/2014","Good",2014-11-27,1,"2014-06-06","2019-09-15",NA
"442","For-profit","SC066127",4,"NORTHUMBERLAND","Interact Care Limited","13/10/2006","Good",2014-11-27,1,"2014-01-01",NA,NA
"443","Local Authority","SC066651",6,"SHEFFIELD","Sheffield City Council","30/03/2006","Good",2014-11-27,1,"2014-01-01",NA,NA
"444","For-profit","SC420303",5,"TOWER HAMLETS","The Qalb Short Break Services Ltd","16/11/2010","Outstanding",2014-11-27,1,"2014-01-01","2021-06-10",NA
"445","For-profit","SC053145",3,"LANCASHIRE","Partners in Care Limited","02/10/2003","Good",2014-11-27,1,"2014-01-01",NA,NA
"446","For-profit","SC411297",4,"LEICESTERSHIRE",NA,NA,"Good",2014-11-27,1,"2014-01-01","2015-07-28",NA
"447","Third Sector","SC038435",72,"WORCESTERSHIRE","Sunfield Children's Homes Limited","01/10/2003","Good",2014-11-26,1,"2014-01-01",NA,NA
"448","For-profit","SC414516",3,"DERBYSHIRE","Blue Mountain Homes Ltd","28/07/2010","Good",2014-11-26,1,"2014-01-01",NA,NA
"449","Third Sector","SC025720",4,"NORFOLK","Break","16/01/2002","Outstanding",2014-11-26,1,"2014-01-01","2019-10-31",NA
"450","Local Authority","SC033502",7,"BRADFORD","Bradford Childrens Specialist Service","26/06/2003","Good",2014-11-26,1,"2014-01-01",NA,NA
"451","For-profit","SC417250",4,"WEST BERKSHIRE","Calcot Services For Children Limited","22/10/2010","Good",2014-11-26,1,"2014-01-01",NA,NA
"452","Local Authority","SC449096",4,"DURHAM","Durham County Council","25/06/2012","Good",2014-11-26,1,"2014-01-01",NA,NA
"453","For-profit","SC363630",3,"BARNSLEY","Castle Homes Care Ltd","25/01/2008","Outstanding",2014-11-26,1,"2014-01-01",NA,NA
"454","Third Sector","SC016732",12,"BIRMINGHAM",NA,NA,"Outstanding",2014-11-26,1,"2014-01-01","2017-04-03",NA
"455","Local Authority","SC442778",2,"WARRINGTON","Warrington Borough Council","05/03/2012","Outstanding",2014-11-26,1,"2014-01-01","2019-11-13",NA
"456","For-profit","SC473631",6,"ROTHERHAM","Priory Education Services Limited 06244880","03/03/2014","Good",2014-11-26,1,"2014-01-01",NA,NA
"457","For-profit","SC023735",2,"KENT",NA,NA,"Good",2014-11-25,1,"2014-01-01","2015-06-29",NA
"458","Local Authority","SC035492",5,"OLDHAM","Oldham Metropolitan Borough Council","28/10/2003","Good",2014-11-25,1,"2014-01-01",NA,NA
"459","Local Authority","SC037923",6,"HAMPSHIRE",NA,NA,"Good",2014-11-25,1,"2014-01-01","2017-11-08",NA
"460","Local Authority","SC394283",5,"SALFORD","Salford City Council","13/05/2009","Good",2014-11-25,1,"2014-01-01",NA,NA
"461","For-profit","SC394463",3,"STOCKPORT","Cornerstone Children's Homes Limited","08/06/2009","Outstanding",2014-11-25,1,"2014-01-01",NA,NA
"462","Local Authority","SC065679",5,"STAFFORDSHIRE","Staffordshire County Council","24/11/2006","Good",2014-11-25,1,"2014-01-01",NA,NA
"463","For-profit","SC066129",4,"KENT","Fairport Care Services Ltd","19/05/2006","Good",2014-11-25,1,"2014-01-01",NA,NA
"464","Local Authority","SC032163",9,"DORSET","Dorset County Council","18/07/2003","Good",2014-11-25,1,"2014-01-01",NA,NA
"465","For-profit","SC449155",4,"WEST SUSSEX","The Amicus Community Arundel Limited","15/08/2012","Outstanding",2014-11-25,1,"2014-01-01",NA,NA
"466","For-profit","SC419217",4,"BIRMINGHAM","Care And Management Services Limited","18/11/2010","Good",2014-11-25,1,"2014-01-01",NA,NA
"467","For-profit","SC387672",5,"MANCHESTER",NA,NA,"Good",2014-11-25,1,"2014-01-01","2016-11-30",NA
"468","For-profit","SC473891",2,"KENT","Pilgrims Corner Limited","28/03/2014","Good",2014-11-25,1,"2014-01-01",NA,NA
"469","For-profit","SC470479",6,"DORSET","Beaufort Care Group","08/01/2014","Good",2014-11-24,1,"2014-01-01",NA,NA
"470","For-profit","SC477031",5,"STOCKTON ON TEES","Spark Of Genius North East Llp","24/06/2014","Good",2014-11-24,1,"2014-06-24",NA,NA
"471","Local Authority","SC042978",5,"LINCOLNSHIRE","Lincolnshire County Council","24/11/2003","Outstanding",2014-11-24,1,"2014-01-01",NA,NA
"472","For-profit","SC357455",4,"BLACKBURN WITH DARWEN","Woodside House Care Ltd","25/02/2008","Outstanding",2014-11-24,1,"2014-01-01",NA,NA
"473","For-profit","SC474894",3,"NORTHUMBERLAND","A Wilderness Way Ltd","13/05/2014","Good",2014-11-24,1,"2014-05-13",NA,NA
"474","For-profit","SC465925",6,"EAST SUSSEX",NA,NA,"Outstanding",2014-11-21,1,"2014-01-01","2017-06-01",NA
"475","Local Authority","SC039680",10,"LANCASHIRE",NA,NA,"Good",2014-11-21,1,"2014-01-01","2015-12-31",NA
"476","For-profit","SC059261",5,"LIVERPOOL","Considerate Care Limited","25/05/2004","Good",2014-11-21,1,"2014-01-01",NA,NA
"477","For-profit","SC005048",8,"STAFFORDSHIRE","The Partnership of Care Today Children's Services","15/05/1996","Good",2014-11-21,1,"2014-01-01",NA,NA
"478","Local Authority","SC430022",7,"SUFFOLK","Suffolk County Council","02/06/2011","Good",2014-11-20,1,"2014-01-01",NA,NA
"479","Local Authority","SC035972",5,"DERBYSHIRE","Derbyshire County Council",NA,"Good",2014-11-20,1,"2014-01-01","2019-01-04",NA
"480","For-profit","SC477939",2,"ROCHDALE","Meadows Care Ltd","03/06/2014","Good",2014-11-20,1,"2014-06-03",NA,NA
"481","For-profit","SC063794",3,"STAFFORDSHIRE","Esland North Limited","11/05/2005","Good",2014-11-20,1,"2014-01-01",NA,NA
"482","For-profit","SC008269",3,"STOKE ON TRENT","The Partnership of Care Today Children's Services","22/12/2000","Good",2014-11-20,1,"2014-01-01",NA,NA
"483","For-profit","SC008487",6,"STOCKPORT","The Partnership of Care Today Children's Services","18/01/1993","Good",2014-11-20,1,"2014-01-01",NA,NA
"484","For-profit","SC446325",2,"MANCHESTER","Cambian Childcare Ltd","28/05/2012","Good",2014-11-20,1,"2014-01-01",NA,NA
"485","For-profit","SC356604",4,"BARNSLEY","Pebbles Care","04/09/2007","Good",2014-11-20,1,"2014-01-01",NA,NA
"486","For-profit","SC410537",3,"BIRMINGHAM","Positive Pathways Limited","29/06/2010","Good",2014-11-20,1,"2014-01-01",NA,NA
"487","For-profit","SC441514",3,"WORCESTERSHIRE","Priory Education Services Limited 06244880","08/03/2012","Good",2014-11-20,1,"2014-01-01",NA,NA
"488","For-profit","SC475742",9,"LANCASHIRE",NA,NA,"Outstanding",2014-11-20,1,"2014-06-30","2016-06-30",NA
"489","Local Authority","SC035222",3,"STOCKTON ON TEES","Stockton on Tees Borough Council","10/02/2003","Good",2014-11-19,1,"2014-01-01",NA,NA
"490","For-profit","SC061431",3,"LEICESTERSHIRE",NA,NA,"Good",2014-11-19,1,"2014-01-01","2016-05-27",NA
"491","For-profit","SC391860",14,"STAFFORDSHIRE","Priory Education Services Limited 06244880","07/07/2009","Good",2014-11-19,1,"2014-01-01",NA,NA
"492","For-profit","SC470224",10,"LANCASHIRE","Halliwell Homes Limited","11/11/2013","Good",2014-11-19,1,"2014-01-01",NA,NA
"493","For-profit","SC005040",4,"STAFFORDSHIRE","The Partnership of Care Today Children's Services","27/01/2000","Good",2014-11-19,1,"2014-01-01",NA,NA
"494","For-profit","SC014235",7,"BRIGHTON AND HOVE","Lioncare Limited","09/11/1998","Outstanding",2014-11-19,1,"2014-01-01",NA,NA
"495","Local Authority","SC034419",4,"NORFOLK","Norfolk County Council Children's Services","10/09/2003","Outstanding",2014-11-19,1,"2014-01-01",NA,NA
"496","For-profit","SC361385",5,"NORFOLK","Clover Childcare Services Ltd","05/10/2007","Outstanding",2014-11-19,1,"2014-01-01",NA,NA
"497","For-profit","SC379274",4,"WAKEFIELD","Pebbles Care","18/07/2008","Good",2014-11-19,1,"2014-01-01",NA,NA
"498","For-profit","SC384018",4,"ESSEX","Surecare Residential Ltd","05/11/2008","Good",2014-11-19,1,"2014-01-01",NA,NA
"499","Local Authority","SC034652",6,"TOWER HAMLETS","London Borough of Tower Hamlets",NA,"Good",2014-11-19,1,"2014-01-01","2018-09-16",NA
"500","For-profit","SC455991",4,"DEVON","Cambian Signpost Limited","19/12/2012","Good",2014-11-19,1,"2014-01-01",NA,NA
"501","For-profit","SC357077",4,"NOTTINGHAM","Pathway Care Solutions Ii Ltd","13/06/2007","Outstanding",2014-11-19,1,"2014-01-01",NA,NA
"502","For-profit","SC456800",2,"WARRINGTON","Cambian Childcare Ltd","14/02/2013","Good",2014-11-19,1,"2014-01-01",NA,NA
"503","For-profit","SC456911",6,"CAMBRIDGESHIRE","Cambian Childcare Ltd","25/02/2013","Good",2014-11-19,1,"2014-01-01",NA,NA
"504","Local Authority","SC035107",7,"BIRMINGHAM",NA,NA,"Good",2014-11-19,1,"2014-01-01","2018-03-21",NA
"505","Third Sector","SC439153",4,"CAMBRIDGESHIRE","Break","01/02/2012","Good",2014-11-19,1,"2014-01-01",NA,NA
"506","For-profit","SC473877",2,"KENT","Pilgrims Corner Limited","28/03/2014","Good",2014-11-19,1,"2014-01-01",NA,NA
"507","For-profit","SC476185",20,"LINCOLNSHIRE",NA,NA,"Good",2014-11-19,1,"2014-06-27","2017-05-18",NA
"508","For-profit","SC457435",2,"NORTH YORKSHIRE","Cambian Childcare Ltd","20/01/2013","Good",2014-11-19,1,"2014-01-01",NA,NA
"509","Third Sector","SC035518",28,"STOCKPORT","Sea Shell Trust Limited","19/01/2004","Good",2014-11-18,1,"2014-01-01",NA,NA
"510","Local Authority","SC035954",9,"WIRRAL","Metropolitan Borough of Wirral","12/09/2003","Outstanding",2014-11-18,1,"2014-01-01",NA,NA
"511","Local Authority","SC038827",6,"HAMPSHIRE",NA,NA,"Good",2014-11-18,1,"2014-01-01","2015-10-10",NA
"512","For-profit","SC031220",5,"CALDERDALE","Compass Children's Homes Ltd","24/09/2002","Good",2014-11-18,1,"2014-01-01",NA,NA
"513","For-profit","SC401927",4,"KENT","Benecare Limited","16/02/2010","Good",2014-11-18,1,"2014-01-01",NA,NA
"514","For-profit","SC059180",5,"DURHAM","Interact Care Limited","31/03/2004","Good",2014-11-18,1,"2014-01-01",NA,NA
"515","For-profit","SC063813",6,"STAFFORDSHIRE","Dmr Services Limited","13/06/2005","Good",2014-11-18,1,"2014-01-01",NA,NA
"516","For-profit","SC008325",1,"STOKE ON TRENT","Searchlight Care Services Ltd",NA,"Good",2014-11-18,1,"2014-01-01","2018-10-02",NA
"517","For-profit","SC454647",4,"SHROPSHIRE","Cambian Childcare Ltd","12/11/2012","Good",2014-11-18,1,"2014-01-01",NA,NA
"518","For-profit","SC455864",8,"MIDDLESBROUGH","Holme Farm Residential Village Limited","11/03/2013","Good",2014-11-18,1,"2014-01-01",NA,NA
"519","For-profit","SC456846",3,"CAMBRIDGESHIRE","Cambian Childcare Ltd","25/02/2013","Outstanding",2014-11-18,1,"2014-01-01",NA,NA
"520","Local Authority","SC035137",3,"DURHAM","Durham County Council","04/09/2003","Good",2014-11-18,1,"2014-01-01",NA,NA
"521","Local Authority","SC427165",3,"NOTTINGHAM","Nottingham City Council","19/05/2011","Good",2014-11-17,1,"2014-01-01",NA,NA
"522","For-profit","SC456053",3,"DORSET",NA,NA,"Good",2014-11-17,1,"2014-01-01","2015-12-31",NA
"523","For-profit","SC456417",4,"CHESHIRE WEST AND CHESTER","Good Foundations Limited","21/12/2012","Good",2014-11-17,1,"2014-01-01",NA,NA
"524","Local Authority","SC035105",4,"DURHAM","Durham County Council","05/09/2003","Good",2014-11-17,1,"2014-01-01","2021-06-09",NA
"525","Local Authority","SC067753",16,"WEST SUSSEX","West Sussex County Council","14/06/2006","Good",2014-11-14,1,"2014-01-01",NA,NA
"526","For-profit","SC389698",2,"BEDFORD","Oracle Care Limited","27/01/2009","Good",2014-11-14,1,"2014-01-01",NA,NA
"527","For-profit","SC060590",3,"CHESHIRE EAST","Castle Homes Care Ltd","20/09/2004","Good",2014-11-13,1,"2014-01-01",NA,NA
"528","Third Sector","SC012021",30,"HAMPSHIRE","The Loddon Foundation Ltd","14/02/2002","Outstanding",2014-11-13,1,"2014-01-01",NA,NA
"529","For-profit","SC061928",8,"MANCHESTER",NA,NA,"Good",2014-11-13,1,"2014-01-01","2016-03-21",NA
"530","Local Authority","SC429523",4,"CORNWALL","Cornwall Partnership NHS Foundation Trust","01/04/2012","Good",2014-11-13,1,"2014-01-01",NA,NA
"531","For-profit","SC020558",22,"TELFORD AND WREKIN","Overley Hall School Limited","16/04/2001","Outstanding",2014-11-13,1,"2014-01-01",NA,NA
"532","Local Authority","SC406505",12,"LEEDS","Leeds City Council","02/02/2010","Outstanding",2014-11-13,1,"2014-01-01",NA,NA
"533","For-profit","SC446262",2,"STAFFORDSHIRE",NA,NA,"Outstanding",2014-11-13,1,"2014-01-01","2015-11-24",NA
"534","Local Authority","SC447930",2,"WARRINGTON","Warrington Borough Council","28/05/2012","Outstanding",2014-11-13,1,"2014-01-01","2021-06-23",NA
"535","For-profit","SC456542",1,"ROCHDALE","Cambian Childcare Ltd","15/02/2013","Good",2014-11-13,1,"2014-01-01",NA,NA
"536","Local Authority","SC037467",9,"WORCESTERSHIRE","Worcestershire County Council",NA,"Outstanding",2014-11-13,1,"2014-01-01","2018-12-27",NA
"537","For-profit","SC054468",3,"WOKINGHAM","Calcot Services For Children Limited","03/12/2003","Good",2014-11-13,1,"2014-01-01","2022-08-01",NA
"538","For-profit","SC068067",5,"BRIGHTON AND HOVE","Lioncare Limited",NA,"Good",2014-11-12,1,"2014-01-01","2018-09-24",NA
"539","Local Authority","SC369339",7,"ROTHERHAM",NA,NA,"Good",2014-11-12,1,"2014-01-01","2016-10-10",NA
"540","For-profit","SC370899",3,"LINCOLNSHIRE","Keys Care Limited","15/02/2008","Good",2014-11-12,1,"2014-01-01",NA,NA
"541","For-profit","SC429918",4,"WARWICKSHIRE","Archways Care Ltd","22/07/2011","Good",2014-11-12,1,"2014-01-01",NA,NA
"542","For-profit","SC430587",4,"NORTHAMPTONSHIRE","Direct Care Ltd","07/07/2011","Inadequate",2014-11-12,1,"2014-01-01",NA,NA
"543","For-profit","SC462729",4,"ESSEX","Surecare Residential Ltd","22/05/2013","Good",2014-11-12,1,"2014-01-01",NA,NA
"544","For-profit","SC015254",5,"CAMBRIDGESHIRE","Castle Homes Limited","01/08/1999","Outstanding",2014-11-12,1,"2014-01-01",NA,NA
"545","Local Authority","SC036248",5,"DERBYSHIRE","Derbyshire County Council","11/12/2003","Good",2014-11-12,1,"2014-01-01",NA,NA
"546","Local Authority","SC039038",7,"LEICESTER","Leicester City Council","31/03/2003","Outstanding",2014-11-12,1,"2014-01-01",NA,NA
"547","For-profit","SC020607",3,"SHROPSHIRE","New Horizons Childcare Ltd","06/08/2001","Good",2014-11-12,1,"2014-01-01",NA,NA
"548","For-profit","SC028536",2,"EAST SUSSEX","Anderida Adolescent Care","01/05/2002","Good",2014-11-12,1,"2014-01-01",NA,NA
"549","For-profit","SC066115",4,"LANCASHIRE","Alliance Care & Education Limited","31/05/2006","Good",2014-11-12,1,"2014-01-01",NA,NA
"550","Local Authority","SC380956",3,"NORTH EAST LINCOLNSHIRE","North East Lincolnshire Council","29/05/2009","Good",2014-11-12,1,"2014-01-01",NA,NA
"551","For-profit","SC063259",8,"NORFOLK","SES Avocet Limited","25/04/2005","Good",2014-11-12,1,"2014-01-01",NA,NA
"552","For-profit","SC063653",2,"STAFFORDSHIRE","Future In Mind Limited","09/05/2005","Good",2014-11-12,1,"2014-01-01",NA,NA
"553","Third Sector","SC008132",4,"NORTH SOMERSET",NA,NA,"Outstanding",2014-11-12,1,"2014-01-01","2016-03-03",NA
"554","For-profit","SC444869",14,"STAFFORDSHIRE","Hopedale Children and Family Services Limited","10/05/2012","Good",2014-11-12,1,"2014-01-01",NA,NA
"555","For-profit","SC449954",3,"NOTTINGHAM","Total Care Matters Limited","15/10/2012","Good",2014-11-12,1,"2014-01-01",NA,NA
"556","For-profit","SC450701",5,"NORTHAMPTONSHIRE","","07/11/2012","Good",2014-11-12,1,"2014-01-01","2021-10-11",NA
"557","For-profit","SC397933",2,"TELFORD AND WREKIN","Cove Care Residential Ltd","30/07/2009","Good",2014-11-12,1,"2014-01-01",NA,NA
"558","For-profit","SC037248",6,"BARKING AND DAGENHAM","Holibrook House Limited","13/11/2003","Good",2014-11-12,1,"2014-01-01",NA,NA
"559","For-profit","SC005050",5,"STAFFORDSHIRE","The Partnership of Care Today Children's Services","15/05/1996","Outstanding",2014-11-12,1,"2014-01-01",NA,NA
"560","For-profit","SC407753",4,"DEVON","3 Dimensions Care Limited","04/03/2010","Good",2014-11-12,1,"2014-01-01","2022-09-23",NA
"561","Local Authority","SC440309",6,"LANCASHIRE","Lancashire County Council","04/01/2012","Good",2014-11-12,1,"2014-01-01",NA,NA
"562","For-profit","SC476236",4,"SHROPSHIRE","Cambian Childcare Ltd","24/04/2014","Good",2014-11-12,1,"2014-04-24",NA,NA
"563","Local Authority","SC037941",7,"CUMBRIA",NA,NA,"Good",2014-11-11,1,"2014-01-01","2017-02-01",NA
"564","For-profit","SC064557",6,"CAMBRIDGESHIRE","4d Care Ltd","04/10/2005","Good",2014-11-11,1,"2014-01-01",NA,NA
"565","Local Authority","SC413177",4,"CHESHIRE WEST AND CHESTER","Cheshire West And Chester Council",NA,"Good",2014-11-11,1,"2014-01-01","2018-06-20",NA
"566","For-profit","SC461938",2,"WIRRAL","Crystal Care Solutions Limited Company Number 05952454","21/05/2013","Good",2014-11-11,1,"2014-01-01",NA,NA
"567","For-profit","SC066428",5,"LANCASHIRE","Roc Northwest Ltd","01/03/2006","Good",2014-11-11,1,"2014-01-01",NA,NA
"568","Local Authority","SC031537",6,"SLOUGH",NA,NA,"Good",2014-11-11,1,"2014-01-01","2015-09-30",NA
"569","For-profit","SC456726",3,"DEVON",NA,NA,"Outstanding",2014-11-11,1,"2014-01-01","2018-02-18",NA
"570","For-profit","SC006294",4,"WAKEFIELD","Dove Adolescent Services Limited","14/05/1998","Outstanding",2014-11-11,1,"2014-01-01",NA,NA
"571","For-profit","SC000820",5,"DARLINGTON","Pear Tree Projects Limited","28/06/2001","Good",2014-11-10,1,"2014-01-01",NA,NA
"572","Local Authority","SC033629",6,"NEWCASTLE UPON TYNE",NA,NA,"Outstanding",2014-11-10,1,"2014-01-01","2016-09-01",NA
"573","For-profit","SC058622",3,"SEFTON","Family Care Associates Limited",NA,"Outstanding",2014-11-10,1,"2014-01-01","2018-11-22",NA
"574","Local Authority","SC037471",4,"WORCESTERSHIRE","Worcestershire County Council","19/01/2004","Outstanding",2014-11-10,1,"2014-01-01","2019-10-01",NA
"575","For-profit","SC389830",1,"SHROPSHIRE","Reflexion Care Group Limited","03/02/2009","Good",2014-11-10,1,"2014-01-01",NA,NA
"576","Local Authority","SC391503",4,"CENTRAL BEDFORDSHIRE","Central Bedfordshire Council","30/03/2009","Good",2014-11-07,1,"2014-01-01",NA,NA
"577","For-profit","SC416318",4,"LANCASHIRE","Bay View Child Care Limited","22/12/2010","Outstanding",2014-11-07,1,"2014-01-01",NA,NA
"578","For-profit","SC043972",5,"MANCHESTER","Cambian Childcare Ltd","30/06/2003","Good",2014-11-07,1,"2014-01-01",NA,NA
"579","Local Authority","SC032240",6,"LIVERPOOL",NA,NA,"Good",2014-11-07,1,"2014-01-01","2016-08-08",NA
"580","For-profit","SC457180",3,"WARRINGTON","Cambian Childcare Ltd","14/02/2013","Good",2014-11-07,1,"2014-01-01",NA,NA
"581","For-profit","SC041114",4,"WALSALL",NA,NA,"Good",2014-11-07,1,"2014-01-01","2017-04-18",NA
"582","Local Authority","SC035352",8,"NORTHAMPTONSHIRE","Northamptonshire County Council","09/04/2003","Good",2014-11-06,1,"2014-01-01","2020-10-31",NA
"583","For-profit","SC065046",4,"BOURNEMOUTH","Beaufort Care Group","16/09/2005","Good",2014-11-06,1,"2014-01-01",NA,NA
"584","Local Authority","SC065059",2,"STOKE ON TRENT","Stoke On Trent City Council","22/02/2006","Good",2014-11-06,1,"2014-01-01",NA,NA
"585","For-profit","SC461781",4,"HAMPSHIRE","New Forest Care Ltd","21/05/2013","Outstanding",2014-11-06,1,"2014-01-01",NA,NA
"586","For-profit","SC464759",4,"DERBYSHIRE","Blue Mountain Homes Ltd","11/04/2014","Good",2014-11-06,1,"2014-04-11",NA,NA
"587","For-profit","SC014848",6,"WEST SUSSEX","Cornerways Children's Services Limited","01/07/2001","Good",2014-11-06,1,"2014-01-01",NA,NA
"588","Local Authority","SC034495",8,"KINGSTON UPON HULL","Kingston Upon Hull City Council","01/04/2003","Good",2014-11-06,1,"2014-01-01",NA,NA
"589","For-profit","SC477900",4,"ESSEX","Care Focus Limited","06/06/2014","Good",2014-11-06,1,"2014-06-06",NA,NA
"590","For-profit","SC403907",5,"NORTHAMPTONSHIRE",NA,NA,"Good",2014-11-06,1,"2014-01-01","2017-05-24",NA
"591","For-profit","SC448129",2,"WAKEFIELD","Keswick Care Limited",NA,"Good",2014-11-06,1,"2014-01-01","2018-10-05",NA
"592","For-profit","SC456532",2,"ROCHDALE","Cambian Childcare Ltd","06/03/2013","Good",2014-11-06,1,"2014-01-01",NA,NA
"593","Local Authority","SC399222",3,"WEST SUSSEX","West Sussex County Council","11/08/2009","Outstanding",2014-11-06,1,"2014-01-01",NA,NA
"594","For-profit","SC051739",3,"NOTTINGHAMSHIRE","Pathway Care Solutions Ii Ltd","24/11/2003","Outstanding",2014-11-06,1,"2014-01-01",NA,NA
"595","For-profit","SC434520",4,"STAFFORDSHIRE","Prestige Adolescent Care And Education Limited","14/09/2011","Outstanding",2014-11-06,1,"2014-01-01",NA,NA
"596","For-profit","SC460740",4,"NEWHAM","","22/07/2013","Good",2014-11-06,1,"2014-01-01","2019-08-19",NA
"597","Local Authority","SC037986",5,"BRACKNELL FOREST","Bracknell Forest Borough Council","09/12/2003","Outstanding",2014-11-05,1,"2014-01-01",NA,NA
"598","Local Authority","SC068511",6,"KENT","Kent County Council","05/10/2006","Outstanding",2014-11-05,1,"2014-01-01",NA,NA
"599","For-profit","SC370910",3,"CAMBRIDGESHIRE","Keys Care Limited","15/02/2008","Outstanding",2014-11-05,1,"2014-01-01",NA,NA
"600","For-profit","SC381522",3,"NOTTINGHAMSHIRE","East Midlands Care Matters Limited","06/10/2008","Good",2014-11-05,1,"2014-01-01",NA,NA
"601","For-profit","SC381652",2,"DEVON","Phoenix Child Care Limited","15/10/2008","Good",2014-11-05,1,"2014-01-01","2019-05-22",NA
"602","For-profit","SC451819",4,"WILTSHIRE","Wessex College","07/08/2012","Good",2014-11-05,1,"2014-01-01","2021-09-21",NA
"603","For-profit","SC454266",4,"MIDDLESBROUGH","Cambian Childcare Ltd","13/12/2012","Good",2014-11-05,1,"2014-01-01",NA,NA
"604","For-profit","SC067989",4,"GLOUCESTERSHIRE","Marlowe Child & Family Services Limited",NA,"Good",2014-11-05,1,"2014-01-01","2018-06-06",NA
"605","For-profit","SC372621",2,"TELFORD AND WREKIN","Bryn Melyn Care","14/07/2008","Good",2014-11-05,1,"2014-01-01",NA,NA
"606","For-profit","SC372664",1,"SHROPSHIRE","Bryn Melyn Care","30/07/2008","Good",2014-11-05,1,"2014-01-01","2021-06-15",NA
"607","Local Authority","SC040638",6,"SURREY","Surrey County Council","18/11/2003","Good",2014-11-05,1,"2014-01-01",NA,NA
"608","Local Authority","SC439882",6,"DERBYSHIRE","Derbyshire County Council","31/01/2012","Outstanding",2014-11-05,1,"2014-01-01",NA,NA
"609","For-profit","SC460063",5,"EAST RIDING OF YORKSHIRE","Cambian Childcare Ltd","11/03/2013","Good",2014-11-05,1,"2014-01-01",NA,NA
"610","Local Authority","SC033387",8,"KIRKLEES","Kirklees Council","01/10/2003","Good",2014-11-04,1,"2014-01-01",NA,NA
"611","Local Authority","SC035454",4,"LANCASHIRE",NA,NA,"Good",2014-11-04,1,"2014-01-01","2016-01-15",NA
"612","Local Authority","SC037910",5,"HAMPSHIRE","Hampshire County Council","09/12/2003","Outstanding",2014-11-04,1,"2014-01-01",NA,NA
"613","For-profit","SC038526",5,"WALSALL","Progress Children's Services","10/01/2003","Good",2014-11-04,1,"2014-01-01",NA,NA
"614","Local Authority","SC036773",5,"GATESHEAD","Gateshead Council","21/05/2003","Good",2014-11-04,1,"2014-01-01",NA,NA
"615","For-profit","SC031763",3,"LINCOLNSHIRE","Castle Homes Care Ltd","19/12/2002","Good",2014-11-04,1,"2014-01-01","2019-09-30",NA
"616","Local Authority","SC034643",7,"BIRMINGHAM",NA,NA,"Good",2014-11-04,1,"2014-01-01","2018-03-21",NA
"617","Local Authority","SC037670",2,"KNOWSLEY","Knowsley Metropolitan Borough Council","04/02/2003","Good",2014-11-04,1,"2014-01-01",NA,NA
"618","For-profit","SC062268",3,"LANCASHIRE","Doncaster Deaf Trust","17/03/2006","Good",2014-11-04,1,"2014-01-01",NA,NA
"619","Local Authority","SC443337",7,"HAMMERSMITH AND FULHAM","London Borough of Hammersmith & Fulham","10/02/2012","Good",2014-11-04,1,"2014-01-01",NA,NA
"620","For-profit","SC457507",3,"WIRRAL",NA,NA,"Good",2014-11-04,1,"2014-01-01","2016-11-01",NA
"621","For-profit","SC065312",8,"NORTHUMBERLAND","Howard House Care Limited","30/11/2005","Good",2014-11-03,1,"2014-01-01","2020-11-03",NA
"622","Local Authority","SC039683",6,"LANCASHIRE","Lancashire County Council","19/08/2003","Outstanding",2014-11-03,1,"2014-01-01",NA,NA
"623","For-profit","SC418605",3,"DURHAM","Pear Tree Projects Limited","21/02/2011","Good",2014-11-03,1,"2014-01-01",NA,NA
"624","For-profit","SC066481",4,"HAMPSHIRE","Fairways Care (uk) Limited","26/02/2006","Good",2014-10-31,1,"2014-01-01",NA,NA
"625","For-profit","SC422481",2,"ST HELENS","Inspire Childrens Services Limited","21/12/2010","Good",2014-10-31,1,"2014-01-01",NA,NA
"626","For-profit","SC457175",1,"HALTON","Cambian Childcare Ltd","14/02/2013","Good",2014-10-31,1,"2014-01-01",NA,NA
"627","Local Authority","SC035387",6,"STOCKTON ON TEES","Stockton on Tees Borough Council","10/02/2003","Good",2014-10-30,1,"2014-01-01",NA,NA
"628","For-profit","SC412296",3,"EAST SUSSEX","Springfield Road Childrens Homes Ltd","15/11/2010","Good",2014-10-30,1,"2014-01-01",NA,NA
"629","Third Sector","SC413985",4,"SALFORD","The Together Trust","30/09/2010","Good",2014-10-30,1,"2014-01-01",NA,NA
"630","For-profit","SC049382",3,"LEICESTERSHIRE",NA,NA,"Good",2014-10-30,1,"2014-01-01","2016-05-17",NA
"631","For-profit","SC066912",2,"STAFFORDSHIRE","Oracle Care Limited","25/05/2006","Good",2014-10-30,1,"2014-01-01","2022-07-14",NA
"632","Local Authority","SC065730",10,"DERBY","Derby City Council","23/02/2006","Good",2014-10-30,1,"2014-01-01",NA,NA
"633","For-profit","SC356312",3,"HEREFORDSHIRE",NA,NA,"Good",2014-10-30,1,"2014-01-01","2017-03-30",NA
"634","For-profit","SC356318",2,"STOKE ON TRENT","The Partnership of Care Today Children's Services","19/10/2007","Good",2014-10-30,1,"2014-01-01",NA,NA
"635","For-profit","SC400355",3,"STOCKPORT","Social Care Services (clayton) Limited","30/10/2009","Good",2014-10-30,1,"2014-01-01",NA,NA
"636","For-profit","SC005204",6,"HALTON","Keys Childcare Ltd","11/08/2000","Outstanding",2014-10-30,1,"2014-01-01",NA,NA
"637","For-profit","SC436551",3,"STAFFORDSHIRE",NA,NA,"Good",2014-10-30,1,"2014-01-01","2018-03-12",NA
"638","For-profit","SC439535",5,"NORTH YORKSHIRE","Pebbles Care","09/12/2011","Good",2014-10-30,1,"2014-01-01",NA,NA
"639","Third Sector","SC060759",6,"LEWISHAM",NA,NA,"Good",2014-10-29,1,"2014-01-01","2015-12-17",NA
"640","For-profit","SC060811",2,"WAKEFIELD","Dove Adolescent Services Limited","14/09/2004","Good",2014-10-29,1,"2014-01-01","2022-10-19",NA
"641","For-profit","SC430239",5,"TAMESIDE","Cambian Childcare Ltd","15/06/2011","Good",2014-10-29,1,"2014-01-01",NA,NA
"642","For-profit","SC431315",2,"STAFFORDSHIRE","Future In Mind Limited","31/05/2011","Good",2014-10-29,1,"2014-01-01",NA,NA
"643","For-profit","SC020133",8,"DERBYSHIRE","Arnfield Care Limited","26/06/1997","Outstanding",2014-10-29,1,"2014-01-01",NA,NA
"644","For-profit","SC020576",5,"TELFORD AND WREKIN","Castle Homes Care Ltd","19/02/1999","Outstanding",2014-10-29,1,"2014-01-01",NA,NA
"645","For-profit","SC482300",20,"WEST SUSSEX","Hillcrest Childrens Services Limited","22/09/2014","Good",2014-10-29,1,"2014-09-22",NA,NA
"646","For-profit","SC482344",8,"OXFORDSHIRE","Hillcrest Childrens Services Limited","22/10/2014","Good",2014-10-29,1,"2014-10-22",NA,NA
"647","For-profit","SC426751",8,"DERBYSHIRE","Enabling Futures Ltd","10/05/2011","Good",2014-10-29,1,"2014-01-01",NA,NA
"648","For-profit","SC446261",3,"STAFFORDSHIRE","Footsteps A Path To Change 08 Limited","23/04/2012","Good",2014-10-29,1,"2014-01-01",NA,NA
"649","Local Authority","SC037396",4,"WORCESTERSHIRE","Worcestershire County Council","19/01/2004","Outstanding",2014-10-29,1,"2014-01-01","2019-10-01",NA
"650","For-profit","SC475715",7,"LANCASHIRE","Witherslack Group Ltd","08/05/2014","Good",2014-10-29,1,"2014-05-08",NA,NA
"651","For-profit","SC458429",7,"DEVON","Virgin Care Limited","28/03/2013","Good",2014-10-29,1,"2014-01-01","2019-03-31",NA
"652","Local Authority","SC065478",13,"WANDSWORTH","Wandsworth Borough Council","14/11/2005","Good",2014-10-28,1,"2014-01-01",NA,NA
"653","Third Sector","SC025733",17,"CAMBRIDGESHIRE","Friends Therapeutic Community Trust","19/06/1973","Outstanding",2014-10-28,1,"2014-01-01",NA,NA
"654","Local Authority","SC033645",6,"NEWCASTLE UPON TYNE","Newcastle City Council","09/04/2003","Good",2014-10-28,1,"2014-01-01",NA,NA
"655","Local Authority","SC033696",6,"BIRMINGHAM",NA,NA,"Good",2014-10-28,1,"2014-01-01","2016-10-01",NA
"656","For-profit","SC403462",5,"LANCASHIRE","Frances House Ltd","08/12/2009","Outstanding",2014-10-28,1,"2014-01-01",NA,NA
"657","For-profit","SC403956",2,"LANCASHIRE",NA,NA,"Good",2014-10-28,1,"2014-01-01","2016-06-28",NA
"658","Local Authority","SC058778",8,"PETERBOROUGH","Peterborough City Council","30/03/2004","Good",2014-10-28,1,"2014-01-01",NA,NA
"659","Third Sector","SC069336",76,"WEST BERKSHIRE","Prior's Court Foundation","16/03/2007","Good",2014-10-28,1,"2014-01-01",NA,NA
"660","Local Authority","SC034969",4,"NOTTINGHAM","Nottingham City Council","28/11/2003","Outstanding",2014-10-28,1,"2014-01-01",NA,NA
"661","For-profit","SC050418",2,"TELFORD AND WREKIN","Educare Adolescent Services Limited","25/05/2004","Good",2014-10-28,1,"2014-01-01","2019-06-10",NA
"662","Local Authority","SC031479",5,"SOUTHWARK","London Borough of Southwark","28/03/2003","Good",2014-10-27,1,"2014-01-01",NA,NA
"663","For-profit","SC363422",3,"LINCOLNSHIRE","Broadwood Education Services","10/09/2007","Outstanding",2014-10-27,1,"2014-01-01",NA,NA
"664","For-profit","SC420388",4,"BURY","Alliance Care & Education Limited","22/12/2010","Good",2014-10-27,1,"2014-01-01",NA,NA
"665","For-profit","SC046480",4,"BOURNEMOUTH","Beaufort Care Group","04/07/2003","Good",2014-10-24,1,"2014-01-01",NA,NA
"666","For-profit","SC060554",2,"STAFFORDSHIRE","Mulberry House Care Homes Limited","28/05/2004","Good",2014-10-24,1,"2014-01-01",NA,NA
"667","Local Authority","SC064608",4,"CORNWALL","Cornwall Council",NA,"Good",2014-10-24,1,"2014-01-01","2018-04-01",NA
"668","For-profit","SC396104",6,"TAMESIDE","Full Circle Care","21/07/2009","Outstanding",2014-10-24,1,"2014-01-01",NA,NA
"669","For-profit","SC008270",2,"STOKE ON TRENT","The Partnership of Care Today Children's Services","01/12/2000","Good",2014-10-24,1,"2014-01-01",NA,NA
"670","For-profit","SC417395",2,"WEST SUSSEX",NA,NA,"Good",2014-10-24,1,"2014-01-01","2016-05-16",NA
"671","For-profit","SC398391",3,"SHROPSHIRE","Hillcrest Children's Services (2) Ltd","21/07/2009","Good",2014-10-24,1,"2014-01-01",NA,NA
"672","For-profit","SC457127",2,"STAFFORDSHIRE",NA,NA,"Good",2014-10-24,1,"2014-01-01","2015-09-04",NA
"673","For-profit","SC007608",3,"DURHAM","Pear Tree Projects Limited","30/06/2001","Good",2014-10-24,1,"2014-01-01",NA,NA
"674","Local Authority","SC035459",6,"LANCASHIRE","Lancashire County Council","03/11/2003","Outstanding",2014-10-23,1,"2014-01-01",NA,NA
"675","Third Sector","SC393048",33,"CAMBRIDGESHIRE",NA,NA,"Good",2014-10-23,1,"2014-01-01","2016-05-12",NA
"676","For-profit","SC413992",11,"EAST SUSSEX","Mayne Enterprises Limited","01/02/2011","Good",2014-10-23,1,"2014-01-01","2023-01-24",NA
"677","For-profit","SC431806",4,"BRACKNELL FOREST","SWAAY Child and Adolescent Services Limited","28/07/2011","Good",2014-10-23,1,"2014-01-01",NA,NA
"678","For-profit","SC462148",2,"NOTTINGHAM","Pathway Care Solutions Ii Ltd","28/03/2013","Good",2014-10-23,1,"2014-01-01","2019-03-04",NA
"679","For-profit","SC005039",2,"STAFFORDSHIRE","Educare Adolescent Services Limited","27/01/2000","Good",2014-10-23,1,"2014-01-01","2019-05-14",NA
"680","Third Sector","SC025740",6,"STOCKPORT","The Together Trust","23/10/1997","Outstanding",2014-10-23,1,"2014-01-01",NA,NA
"681","Local Authority","SC039559",4,"HALTON","Halton Borough Council","15/09/2003","Outstanding",2014-10-23,1,"2014-01-01",NA,NA
"682","For-profit","SC482296",8,"OXFORDSHIRE","Hillcrest Childrens Services Limited","22/09/2014","Outstanding",2014-10-23,1,"2014-09-22",NA,NA
"683","For-profit","SC362233",3,"LEICESTERSHIRE",NA,NA,"Good",2014-10-23,1,"2014-01-01","2017-01-31",NA
"684","For-profit","SC456477",4,"NORTH YORKSHIRE","Cambian Childcare Ltd","20/01/2013","Good",2014-10-23,1,"2014-01-01",NA,NA
"685","For-profit","SC067865",3,"BARNSLEY","Keswick Care Limited","25/10/2006","Good",2014-10-23,1,"2014-01-01",NA,NA
"686","For-profit","SC377825",3,"BIRMINGHAM","Castle Homes Care Ltd","08/07/2008","Outstanding",2014-10-23,1,"2014-01-01",NA,NA
"687","For-profit","SC457068",3,"HEREFORDSHIRE","Cambian Childcare Ltd","03/08/2013","Outstanding",2014-10-23,1,"2014-01-01",NA,NA
"688","For-profit","SC457182",1,"HALTON","Cambian Childcare Ltd","14/02/2013","Good",2014-10-23,1,"2014-01-01",NA,NA
"689","For-profit","SC007284",6,"WALTHAM FOREST","Horizon Residential Children's Home","18/04/2000","Outstanding",2014-10-23,1,"2014-01-01",NA,NA
"690","Local Authority","SC408369",2,"STOKE ON TRENT","Stoke On Trent City Council","11/03/2010","Good",2014-10-23,1,"2014-01-01",NA,NA
"691","For-profit","SC411030",3,"ROCHDALE","Meadows Care Ltd","07/06/2010","Good",2014-10-23,1,"2014-01-01",NA,NA
"692","Third Sector","SC437948",4,"MEDWAY",NA,NA,"Inadequate",2014-10-23,1,"2014-01-01","2015-04-23",NA
"693","For-profit","SC475335",4,"NOTTINGHAMSHIRE","Blue Mountain Homes Ltd","13/06/2014","Good",2014-10-23,1,"2014-06-13",NA,NA
"694","Local Authority","SC044963",16,"ESSEX",NA,NA,"Good",2014-10-22,1,"2014-01-01","2017-12-27",NA
"695","For-profit","SC059753",2,"WILTSHIRE","Five Rivers Child Care Limited","03/02/2004","Good",2014-10-22,1,"2014-01-01",NA,NA
"696","For-profit","SC064454",2,"BARNSLEY","Dove Adolescent Services Limited","28/12/2005","Good",2014-10-22,1,"2014-01-01",NA,NA
"697","Local Authority","SC068076",2,"NORFOLK","Norfolk County Council Children's Services","15/09/2006","Good",2014-10-22,1,"2014-01-01",NA,NA
"698","For-profit","SC433286",2,"DEVON","Keys Group Progressive Care & Education Limited","10/08/2011","Outstanding",2014-10-22,1,"2014-01-01",NA,NA
"699","For-profit","SC465940",7,"SOMERSET","Priory Education Services Limited 06244880","20/08/2013","Good",2014-10-22,1,"2014-01-01",NA,NA
"700","Third Sector","SC025715",3,"STOCKPORT","The Together Trust","24/02/2000","Good",2014-10-22,1,"2014-01-01",NA,NA
"701","For-profit","SC025812",4,"CROYDON","McRae Residential Care Services Limited","06/06/1996","Good",2014-10-22,1,"2014-01-01",NA,NA
"702","For-profit","SC029078",10,"MEDWAY","","14/05/2002","Outstanding",2014-10-22,1,"2014-01-01","2020-12-31",NA
"703","Third Sector","SC034415",20,"KIRKLEES","Hollybank Trust 1043129","07/01/2003","Good",2014-10-22,1,"2014-01-01",NA,NA
"704","Local Authority","SC039676",10,"LANCASHIRE","Lancashire County Council","06/01/2004","Good",2014-10-22,1,"2014-01-01","2022-12-12",NA
"705","Local Authority","SC381089",2,"STOKE ON TRENT","Stoke On Trent City Council","04/09/2008","Good",2014-10-22,1,"2014-01-01",NA,NA
"706","For-profit","SC411046",3,"LANCASHIRE","Lifetime Opportunities Ltd","26/07/2010","Good",2014-10-22,1,"2014-01-01",NA,NA
"707","For-profit","SC411142",1,"SHROPSHIRE","Bryn Melyn Care","03/06/2010","Good",2014-10-22,1,"2014-01-01",NA,NA
"708","For-profit","SC024089",4,"KENT","Esland South Limited","22/06/2001","Good",2014-10-21,1,"2014-01-01",NA,NA
"709","Third Sector","SC013402",12,"KINGSTON UPON THAMES","Action For Children","09/10/1996","Good",2014-10-21,1,"2014-01-01","2021-02-22",NA
"710","For-profit","SC482295",6,"OXFORDSHIRE","Hillcrest Childrens Services Limited","22/09/2014","Good",2014-10-21,1,"2014-09-22",NA,NA
"711","Third Sector","SC416733",3,"NORFOLK",NA,NA,"Good",2014-10-21,1,"2014-01-01","2017-06-21",NA
"712","For-profit","SC477726",2,"WIGAN","Crystal Care Solutions Limited Company Number 05952454","18/07/2014","Good",2014-10-20,1,"2014-07-18",NA,NA
"713","For-profit","SC475121",5,"BARNSLEY",NA,NA,"Good",2014-10-20,1,"2014-04-10","2016-10-13",NA
"714","Local Authority","SC034158",4,"CUMBRIA","Cumbria County Council","28/07/2003","Outstanding",2014-10-18,1,"2014-01-01",NA,NA
"715","For-profit","SC038066",3,"BIRMINGHAM","Thoughts of Others Ltd",NA,"Good",2014-10-17,1,"2014-01-01","2018-07-26",NA
"716","For-profit","SC406638",3,"WALTHAM FOREST","Winsbeach Children's Home Limited","18/02/2010","Good",2014-10-17,1,"2014-01-01",NA,NA
"717","For-profit","SC444289",4,"NORTH YORKSHIRE","Pear Tree Projects Limited","03/07/2012","Good",2014-10-17,1,"2014-01-01",NA,NA
"718","For-profit","SC066897",31,"HAMPSHIRE","Cambian Autism Services Limited","13/04/2006","Good",2014-10-17,1,"2014-01-01",NA,NA
"719","Third Sector","SC045096",4,"SOMERSET","Blackford Education (schools) Ltd","15/04/2004","Good",2014-10-16,1,"2014-01-01","2022-07-26",NA
"720","For-profit","SC391739",2,"WORCESTERSHIRE","Keys Specialist Residential Children's Services Ltd",NA,"Outstanding",2014-10-16,1,"2014-01-01","2018-07-09",NA
"721","For-profit","SC396463",2,"BIRMINGHAM","Cambian Childcare Ltd","30/06/2009","Good",2014-10-16,1,"2014-01-01",NA,NA
"722","For-profit","SC463926",4,"LANCASHIRE","Bay View Child Care Limited","23/05/2013","Good",2014-10-16,1,"2014-01-01",NA,NA
"723","For-profit","SC469396",4,"KENT","Acorn Homes (uk) Ltd","23/12/2013","Good",2014-10-16,1,"2014-01-01",NA,NA
"724","Local Authority","SC036758",4,"SHROPSHIRE",NA,NA,"Good",2014-10-16,1,"2014-01-01","2015-04-14",NA
"725","For-profit","SC022440",1,"ST HELENS","PIC Children's Services Limited","20/07/2001","Good",2014-10-16,1,"2014-01-01","2021-04-28",NA
"726","For-profit","SC005553",7,"OLDHAM","Dalepeak Limited","01/06/1999","Outstanding",2014-10-16,1,"2014-01-01",NA,NA
"727","Local Authority","SC441513",6,"DERBYSHIRE","Derbyshire County Council","02/02/2012","Outstanding",2014-10-16,1,"2014-01-01",NA,NA
"728","For-profit","SC474050",1,"SHROPSHIRE","New Horizons Childcare Ltd","21/05/2014","Good",2014-10-16,1,"2014-05-21","2020-04-01",NA
"729","Local Authority","SC372511",5,"BLACKBURN WITH DARWEN","Blackburn with Darwen Borough Council","19/06/2008","Outstanding",2014-10-15,1,"2014-01-01",NA,NA
"730","For-profit","SC433430",3,"DERBYSHIRE","Esland North Limited","21/07/2011","Good",2014-10-15,1,"2014-01-01",NA,NA
"731","For-profit","SC468747",2,"DEVON","Idem Living Ltd","12/08/2013","Good",2014-10-15,1,"2014-01-01",NA,NA
"732","For-profit","SC471672",4,"BIRMINGHAM","Serenity Specialist Care Limited","21/05/2014","Inadequate",2014-10-15,1,"2014-05-21",NA,NA
"733","Local Authority","SC036240",6,"DERBY","Derby City Council","13/11/2003","Good",2014-10-15,1,"2014-01-01",NA,NA
"734","Local Authority","SC357979",3,"TAMESIDE","Tameside Mbc","20/07/2007","Outstanding",2014-10-15,1,"2014-01-01",NA,NA
"735","Third Sector","SC361212",3,"SANDWELL","St. Christophers Fellowship",NA,"Good",2014-10-15,1,"2014-01-01","2018-08-24",NA
"736","For-profit","SC382994",5,"NOTTINGHAMSHIRE","Pathway Care Solutions Ii Ltd","14/08/2008","Outstanding",2014-10-15,1,"2014-01-01",NA,NA
"737","For-profit","SC057703",2,"BARNSLEY","Dove Adolescent Services Limited","17/03/2004","Outstanding",2014-10-15,1,"2014-01-01",NA,NA
"738","For-profit","SC448598",4,"WINDSOR AND MAIDENHEAD","Broadwood Residential Limited","10/08/2012","Good",2014-10-15,1,"2014-01-01","2019-10-18",NA
"739","For-profit","SC456418",1,"ROCHDALE","Cambian Childcare Ltd","06/03/2013","Good",2014-10-15,1,"2014-01-01",NA,NA
"740","For-profit","SC376676",4,"ESSEX",NA,NA,"Outstanding",2014-10-15,1,"2014-01-01","2018-02-18",NA
"741","Local Authority","SC035155",7,"CALDERDALE","Calderdale Metropolitan Borough Council","09/09/2003","Good",2014-10-15,1,"2014-01-01",NA,NA
"742","Local Authority","SC040733",4,"SALFORD","Salford City Council","25/02/2004","Good",2014-10-15,1,"2014-01-01",NA,NA
"743","For-profit","SC062248",4,"KNOWSLEY","Quality Protects Children Ltd","17/01/2005","Good",2014-10-15,1,"2014-01-01",NA,NA
"744","For-profit","SC016124",3,"SOMERSET","Keys Group Progressive Care & Education Limited","06/12/2001","Good",2014-10-15,1,"2014-01-01",NA,NA
"745","For-profit","SC443549",3,"NOTTINGHAMSHIRE",NA,NA,"Good",2014-10-15,1,"2014-01-01","2017-05-24",NA
"746","For-profit","SC368637",3,"KENT","Channels and Choices Kent LLP","25/01/2008","Good",2014-10-14,1,"2014-01-01",NA,NA
"747","For-profit","SC391708",2,"BOURNEMOUTH","Fairways Care (uk) Limited","29/04/2009","Good",2014-10-14,1,"2014-01-01","2022-06-01",NA
"748","For-profit","SC028174",4,"LINCOLNSHIRE","Direct Care Ltd","24/04/2002","Good",2014-10-14,1,"2014-01-01",NA,NA
"749","Local Authority","SC066796",7,"WAKEFIELD","Wakefield Metropolitan District Council","06/02/2006","Good",2014-10-14,1,"2014-01-01","2022-10-21",NA
"750","For-profit","SC403905",5,"KENT","Rubicon Children's Homes Limited","21/04/2010","Good",2014-10-14,1,"2014-01-01",NA,NA
"751","For-profit","SC417360",3,"SHROPSHIRE","Castlecare Cymru Limited",NA,"Good",2014-10-14,1,"2014-01-01","2018-09-01",NA
"752","For-profit","SC457181",1,"HALTON","Cambian Childcare Ltd","14/02/2013","Good",2014-10-14,1,"2014-01-01",NA,NA
"753","For-profit","SC476486",7,"HEREFORDSHIRE","Priory Education Services Limited 06244880","12/05/2014","Good",2014-10-14,1,"2014-05-12","2022-09-01",NA
"754","For-profit","SC356907",9,"CUMBRIA","North Lakes Children's Services Limited","02/07/2007","Outstanding",2014-10-12,1,"2014-01-01","2022-08-22",NA
"755","For-profit","SC016600",5,"GLOUCESTERSHIRE","Bridge Communities Limited","19/06/1992","Good",2014-10-12,1,"2014-01-01",NA,NA
"756","For-profit","SC413779",2,"ROCHDALE","Aspire Child Care Ltd","02/09/2010","Good",2014-10-10,1,"2014-01-01",NA,NA
"757","For-profit","SC037596",4,"WILTSHIRE","Wessex College","15/11/2002","Good",2014-10-10,1,"2014-01-01",NA,NA
"758","For-profit","SC033268",12,"CUMBRIA","Appletree Treatment Centre Limited","05/02/2004","Good",2014-10-09,1,"2014-01-01",NA,NA
"759","For-profit","SC035625",30,"HEREFORDSHIRE","Rowden House School Limited","30/04/2003","Good",2014-10-09,1,"2014-01-01",NA,NA
"760","For-profit","SC462149",2,"NOTTINGHAMSHIRE","Pathway Care Solutions Ii Ltd","28/03/2013","Good",2014-10-09,1,"2014-01-01","2021-09-04",NA
"761","Third Sector","SC025712",2,"STOCKPORT","The Together Trust","01/12/1997","Outstanding",2014-10-09,1,"2014-01-01",NA,NA
"762","For-profit","SC063197",1,"ROCHDALE",NA,NA,"Good",2014-10-09,1,"2014-01-01","2017-05-18",NA
"763","For-profit","SC455401",5,"STAFFORDSHIRE",NA,NA,"Good",2014-10-09,1,"2014-01-01","2015-04-14",NA
"764","For-profit","SC357159",2,"ROCHDALE","Pathfinders (childcare) Ltd","27/03/2007","Good",2014-10-09,1,"2014-01-01","2020-03-05",NA
"765","For-profit","SC419330",3,"KENT","Castle Homes Limited","03/11/2010","Good",2014-10-09,1,"2014-01-01","2019-08-23",NA
"766","For-profit","SC412125",4,"NORTHAMPTONSHIRE",NA,NA,"Outstanding",2014-10-09,1,"2014-01-01","2015-05-01",NA
"767","For-profit","SC443658",7,"BURY",NA,NA,"Good",2014-10-09,1,"2014-01-01","2016-02-14",NA
"768","For-profit","SC068206",1,"ST HELENS","Crossway Services Limited","11/10/2006","Good",2014-10-08,1,"2014-01-01",NA,NA
"769","For-profit","SC472102",14,"HAMPSHIRE","Priory Education Services Limited 06244880","05/03/2014","Good",2014-10-08,1,"2014-01-01",NA,NA
"770","Local Authority","SC065553",4,"DERBYSHIRE","Derbyshire County Council","24/10/2005","Good",2014-10-08,1,"2014-01-01",NA,NA
"771","For-profit","SC000803",3,"DARLINGTON","Pear Tree Projects Limited","28/06/2001","Good",2014-10-08,1,"2014-01-01",NA,NA
"772","Local Authority","SC039243",8,"LANCASHIRE",NA,NA,"Good",2014-10-08,1,"2014-01-01","2016-02-29",NA
"773","For-profit","SC020171",7,"DERBYSHIRE","Arnfield Care Limited","09/05/2001","Outstanding",2014-10-08,1,"2014-01-01",NA,NA
"774","Local Authority","SC034211",5,"BRISTOL","Bristol City Council","17/04/2003","Good",2014-10-08,1,"2014-01-01","2022-07-01",NA
"775","For-profit","SC066560",2,"ROCHDALE","Meadows Care Ltd","15/02/2006","Good",2014-10-08,1,"2014-01-01",NA,NA
"776","For-profit","SC366080",3,"SHROPSHIRE","Reflexion Care Group Limited","07/01/2008","Good",2014-10-08,1,"2014-01-01",NA,NA
"777","For-profit","SC419808",4,"CHESHIRE WEST AND CHESTER","Good Foundations Limited","12/11/2010","Outstanding",2014-10-08,1,"2014-01-01",NA,NA
"778","For-profit","SC457132",1,"DEVON","Cambian Childcare Ltd","25/02/2013","Good",2014-10-08,1,"2014-01-01",NA,NA
"779","Third Sector","SC037309",9,"KENT","The Caldecott Foundation Limited","04/09/2002","Good",2014-10-08,1,"2014-01-01",NA,NA
"780","Local Authority","SC037657",3,"KNOWSLEY","Knowsley Metropolitan Borough Council","27/11/2003","Good",2014-10-08,1,"2014-01-01",NA,NA
"781","Local Authority","SC035247",7,"DURHAM","Durham County Council","05/09/2003","Good",2014-10-07,1,"2014-01-01",NA,NA
"782","For-profit","SC428895",3,"LEEDS","Cambian Childcare Ltd","17/06/2011","Good",2014-10-07,1,"2014-01-01",NA,NA
"783","For-profit","SC462591",3,"CALDERDALE","G B A Care Ltd","17/04/2013","Good",2014-10-07,1,"2014-01-01",NA,NA
"784","For-profit","SC065189",2,"ROCHDALE","Meadows Care Ltd","05/09/2005","Outstanding",2014-10-07,1,"2014-01-01",NA,NA
"785","Local Authority","SC033664",8,"BIRMINGHAM",NA,NA,"Good",2014-10-07,1,"2014-01-01","2016-10-01",NA
"786","For-profit","SC065789",3,"WIRRAL","Good Foundations Limited","25/10/2005","Good",2014-10-07,1,"2014-01-01",NA,NA
"787","For-profit","SC372617",1,"SHROPSHIRE","Bryn Melyn Care","14/07/2008","Good",2014-10-07,1,"2014-01-01","2021-11-08",NA
"788","For-profit","SC376211",6,"STAFFORDSHIRE","CareTech Community Services Limited","12/05/2008","Good",2014-10-07,1,"2014-01-01",NA,NA
